,id,title,author,journal,year,volume,ref,pages,booktitle
73,@articleMa2018CharacterizingAS,Characterizing Adversarial Subspaces Using Local Intrinsic Dimensionality,"['Xingjun Ma', 'Bo Li', 'Yisen Wang', 'S. Erfani', 'S. Wijewickrema', 'M. E. Houle', 'Grant Schoenebeck', 'D. Song', 'J. Bailey']",ArXiv,2018,abs/1801.02613,"Ma, Xingjun et al. “Characterizing Adversarial Subspaces Using Local Intrinsic Dimensionality.” ArXiv abs/1801.02613 (2018): n. pag.",,
74,@articleXie2018MitigatingAE,Mitigating adversarial effects through randomization,"['Cihang Xie', 'Jianyu Wang', 'Zhishuai Zhang', 'Zhou Ren', 'A. Yuille']",ArXiv,2018,abs/1711.01991,"Xie, Cihang et al. “Mitigating adversarial effects through randomization.” ArXiv abs/1711.01991 (2018): n. pag.",,
75,@articleSong2018PixelDefendLG,PixelDefend: Leveraging Generative Models to Understand and Defend against Adversarial Examples,"['Yang Song', 'Taesup Kim', 'Sebastian Nowozin', 'S. Ermon', 'Nate Kushman']",ArXiv,2018,abs/1710.10766,"Song, Yang et al. “PixelDefend: Leveraging Generative Models to Understand and Defend against Adversarial Examples.” ArXiv abs/1710.10766 (2018): n. pag.",,
76,@articleSharif2016AccessorizeTA,Accessorize to a Crime: Real and Stealthy Attacks on State-of-the-Art Face Recognition,"['Mahmood Sharif', 'Sruti Bhagavatula', 'L. Bauer', 'M. Reiter']",Proceedings of the 2016 ACM SIGSAC Conference on Computer and Communications Security,2016,,"Sharif, Mahmood et al. “Accessorize to a Crime: Real and Stealthy Attacks on State-of-the-Art Face Recognition.” Proceedings of the 2016 ACM SIGSAC Conference on Computer and Communications Security (2016): n. pag.",,
77,@articlePapernot2016TransferabilityIM,Transferability in Machine Learning: from Phenomena to Black-Box Attacks using Adversarial Samples,"['Nicolas Papernot', 'P. McDaniel', 'Ian J. Goodfellow']",ArXiv,2016,abs/1605.07277,"Papernot, Nicolas et al. “Transferability in Machine Learning: from Phenomena to Black-Box Attacks using Adversarial Samples.” ArXiv abs/1605.07277 (2016): n. pag.",,
78,@articleHochreiter1998TheVG,The Vanishing Gradient Problem During Learning Recurrent Neural Nets and Problem Solutions,['S. Hochreiter'],Int. J. Uncertain. Fuzziness Knowl. Based Syst.,1998,6,"Hochreiter, S.. “The Vanishing Gradient Problem During Learning Recurrent Neural Nets and Problem Solutions.” Int. J. Uncertain. Fuzziness Knowl. Based Syst. 6 (1998): 107-116.",107-116,
79,@articleRony2019DecouplingDA,Decoupling Direction and Norm for Efficient Gradient-Based L2 Adversarial Attacks and Defenses,"[""J\\'er\\^ome Rony"", 'Luiz G. Hafemann', 'L. Oliveira', 'I. B. Ayed', 'R. Sabourin', 'Eric Granger']",2019 IEEE/CVF Conference on Computer Vision and Pattern Recognition (CVPR),2019,,"Rony, Jérôme et al. “Decoupling Direction and Norm for Efficient Gradient-Based L2 Adversarial Attacks and Defenses.” 2019 IEEE/CVF Conference on Computer Vision and Pattern Recognition (CVPR) (2019): 4317-4325.",4317-4325,
80,@articleEngstrom2018EvaluatingAU,Evaluating and Understanding the Robustness of Adversarial Logit Pairing,"['L. Engstrom', 'Andrew Ilyas', 'A. Athalye']",ArXiv,2018,abs/1807.10272,"Engstrom, L. et al. “Evaluating and Understanding the Robustness of Adversarial Logit Pairing.” ArXiv abs/1807.10272 (2018): n. pag.",,
81,@articlePang2017RobustDL,Robust Deep Learning via Reverse Cross-Entropy Training and Thresholding Test,"['T. Pang', 'Chao Du', 'J. Zhu']",ArXiv,2017,abs/1706.00633,"Pang, T. et al. “Robust Deep Learning via Reverse Cross-Entropy Training and Thresholding Test.” ArXiv abs/1706.00633 (2017): n. pag.",,
82,@articleHuang2015LearningWA,Learning with a Strong Adversary,"['Ruitong Huang', 'B. Xu', 'Dale Schuurmans', 'Csaba Szepesvari']",ArXiv,2015,abs/1511.03034,"Huang, Ruitong et al. “Learning with a Strong Adversary.” ArXiv abs/1511.03034 (2015): n. pag.",,
83,@articleSabour2016AdversarialMO,Adversarial Manipulation of Deep Representations,"['Sara Sabour', 'Yanshuai Cao', 'Fartash Faghri', 'David J. Fleet']",CoRR,2016,abs/1511.05122,"Sabour, Sara et al. “Adversarial Manipulation of Deep Representations.” CoRR abs/1511.05122 (2016): n. pag.",,
