,0
0,Analysis of classifiers’ robustness to adversarial perturbations
1,signSGD: compressed optimisation for non-convex problems
2,"Deep Compression: Compressing Deep Neural Network with Pruning, Trained Quantization and Huffman Coding"
3,On Calibration of Modern Neural Networks
4,The Arcade Learning Environment: An Evaluation Platform for General Agents (Extended Abstract)
5,MXNet: A Flexible and Efficient Machine Learning Library for Heterogeneous Distributed Systems
6,A Course in Game Theory
7,MagNet: A Two-Pronged Defense against Adversarial Examples
8,Improved Training of Wasserstein GANs
9,Early Methods for Detecting Adversarial Images
10,Task-Aware Compressed Sensing with Generative Adversarial Networks
11,Deep Learning Face Attributes in the Wild
12,Fashion-MNIST: a Novel Image Dataset for Benchmarking Machine Learning Algorithms
13,Densely Connected Convolutional Networks
14,Nonlinear total variation based noise removal algorithms
15,The Split Bregman Method for L1-Regularized Problems
16,Adversary Resistant Deep Neural Networks with an Application to Malware Detection
17,The Concrete Distribution: A Continuous Relaxation of Discrete Random Variables
18,Nonlocally Centralized Sparse Representation for Image Restoration
19,Is Deep Learning Safe for Robot Vision? Adversarial Examples Against the iCub Humanoid
20,Learning Adversary-Resistant Deep Neural Networks
21,"La cryptographie militaire (Auguste Kerckhoffs, 1883)"
22,"Show, Attend, Control, and Justify: Interpretable Learning for Self-Driving Cars"
23,"MagNet and ""Efficient Defenses Against Adversarial Attacks"" are Not Robust to Adversarial Examples"
24,Adversarial Example Defense: Ensembles of Weak Defenses are not Strong
25,Cascade Adversarial Machine Learning Regularized with a Unified Embedding
26,Wide Residual Networks
27,Estimating or Propagating Gradients Through Stochastic Neurons for Conditional Computation
28,PixelCNN++: Improving the PixelCNN with Discretized Logistic Mixture Likelihood and Other Modifications
29,Learning representations by back-propagating errors
30,Learning long-term dependencies with gradient descent is difficult
31,Estimating Local Intrinsic Dimensionality
32,On the (Statistical) Detection of Adversarial Examples
33,Generating Adversarial Malware Examples for Black-Box Attacks Based on GAN
34,The security of machine learning
35,DREBIN: Effective and Explainable Detection of Android Malware in Your Pocket
36,Outside the Closed World: On Using Machine Learning for Network Intrusion Detection
37,Automatic analysis of malware behavior using machine learning
38,Deep neural network based malware detection using two dimensional binary program features
39,An evaluation of Naive Bayesian anti-spam filtering
40,Semantic Adversarial Examples
41,FeatureSmith: Automatically Engineering Features for Malware Detection by Mining the Security Literature
42,MARVIN: Efficient and Comprehensive Mobile App Classification through Static and Dynamic Analysis
43,Dense Associative Memory Is Robust to Adversarial Inputs
44,Using Non-invertible Data Transformations to Build Adversary-Resistant Deep Neural Networks
45,Automated Static Code Analysis for Classifying Android Applications Using Machine Learning
46,Efficient Detection of Zero-day Android Malware Using Normalized Bernoulli Naive Bayes
47,The Motivational Pull of Video Games: A Self-Determination Theory Approach
48,Race-Ethnic Differences in Factors Associated with Inhaled Steroid Adherence Among Adults with Asthma
49,"Activation of NK cells and T cells by NKG2D, a receptor for stress-inducible MICA."
50,Adversarially Regularized Autoencoders
51,Adversarially Regularized Autoencoders for Generating Discrete Structures
52,Variational Approaches for Auto-Encoding Generative Adversarial Networks
53,Improved Techniques for Training GANs
54,Towards Principled Methods for Training Generative Adversarial Networks
55,Do GANs actually learn the distribution? An empirical study
56,LSUN: Construction of a Large-scale Image Dataset using Deep Learning with Humans in the Loop
57,Wasserstein Auto-Encoders
58,Adversarial Examples for Evaluating Reading Comprehension Systems
59,DeepXplore: automated whitebox testing of deep learning systems
60,Toward Controlled Generation of Text
61,Edge-exchangeable graphs and sparsity (NIPS 2016)
62,Synthetic and Natural Noise Both Break Neural Machine Translation
63,Stochastic Gradient VB and the Variational Auto-Encoder
64,Understanding Neural Networks through Representation Erasure
65,Enhanced LSTM for Natural Language Inference
66,A causal framework for explaining the predictions of black-box sequence-to-sequence models
67,Anchors: High-Precision Model-Agnostic Explanations
68,NIPS 2016 Tutorial: Generative Adversarial Networks
69,Provably Minimally-Distorted Adversarial Examples
70,Towards Robust Detection of Adversarial Examples
71,Ground-Truth Adversarial Examples
72,Machine Learning as an Adversarial Service: Learning Black-Box Adversarial Examples
73,Detecting Adversarial Attacks on Neural Network Policies with Visual Foresight
74,DeepDGA: Adversarially-Tuned Domain Generation and Detection
75,DeepSafe: A Data-driven Approach for Checking Adversarial Robustness in Neural Networks
76,Adversarial vulnerability for any classifier
77,Exploring the space of adversarial images
78,Fundamental limits on adversarial robustness
79,SafetyNet: Detecting and Rejecting Adversarial Examples Robustly
80,Learning Universal Adversarial Perturbations with Generative Models
81,"Adversarial Examples, Uncertainty, and Transfer Testing Robustness in Gaussian Process Hybrid Deep Networks"
82,A Boundary Tilting Persepective on the Phenomenon of Adversarial Examples
83,Adversarial Images for Variational Autoencoders
84,Towards Interpretable Deep Neural Networks by Leveraging Adversarial Examples
85,Towards Proving the Adversarial Robustness of Deep Neural Networks
86,Universal Adversarial Perturbations Against Semantic Image Segmentation
87,Foolbox: A Python toolbox to benchmark the robustness of machine learning models
88,Foolbox v0.8.0: A Python toolbox to benchmark the robustness of machine learning models
89,Adversarially Robust Generalization Requires More Data
90,Robustness to Adversarial Examples through an Ensemble of Specialists
91,Standard detectors aren't (currently) fooled by physical adversarial stop signs
92,Enhancing robustness of machine learning systems via data transformations
93,Multiple classifier systems for robust classifier design in adversarial environments
94,Evading Machine Learning Malware Detection
95,Blind Attacks on Machine Learners
96,Adversarial Spheres
97,Dimensionality Reduction as a Defense against Evasion Attacks on Machine Learning Classifiers
98,Adversarial Training for Relation Extraction
99,Photo-Realistic Single Image Super-Resolution Using a Generative Adversarial Network
100,“Unpaired Image-to-Image Translation using Cycle-Consistent Adversarial Networks”の学習報告
101,Reluplex: An Efficient SMT Solver for Verifying Deep Neural Networks
102,Self-Normalizing Neural Networks
103,Scaling learning algorithms towards AI
104,Opening the Black Box of Deep Neural Networks via Information
105,Learning Fast and Slow: PROPEDEUTICA for Real-time Malware Detection
106,Delving Deep into Rectifiers: Surpassing Human-Level Performance on ImageNet Classification
107,Autoencoding beyond pixels using a learned similarity metric
108,Grad-CAM: Visual Explanations from Deep Networks via Gradient-Based Localization
109,Faster R-CNN: Towards Real-Time Object Detection with Region Proposal Networks
110,Asynchronous Methods for Deep Reinforcement Learning
111,Network In Network
112,Very Deep Convolutional Networks for Large-Scale Image Recognition
113,Do Deep Nets Really Need to be Deep?
114,Adaptive Subgradient Methods for Online Learning and Stochastic Optimization
115,Full Resolution Image Compression with Recurrent Neural Networks
116,"You Only Look Once: Unified, Real-Time Object Detection"
117,Robots that can adapt like animals
118,Pattern Recognition Systems under Attack: Design Issues and Research Challenges
119,A Survey of Modern Questions and Challenges in Feature Extraction
120,Fully convolutional networks for semantic segmentation
121,Unsupervised Image-to-Image Translation Networks
122,WaveNet: A Generative Model for Raw Audio
123,"YOLO9000: Better, Faster, Stronger"
124,Mastering the game of Go without human knowledge
125,Single Shot Text Detector with Regional Attention
126,Rethinking Atrous Convolution for Semantic Image Segmentation
127,ArcFace: Additive Angular Margin Loss for Deep Face Recognition
128,Mastering Chess and Shogi by Self-Play with a General Reinforcement Learning Algorithm
129,DolphinAttack: Inaudible Voice Commands
130,"SQuAD: 100, 000+ Questions for Machine Comprehension of Text"
131,The IBM 2015 English conversational telephone speech recognition system
132,A Fast Uyghur Text Detector for Complex Background Images
133,Image Quality Assessment Using the SSIM and the Just Noticeable Difference Paradigm
134,The Mythos of Model Interpretability
135,Recommender Systems Based on Generative Adversarial Networks: A Problem-Driven Perspective
136,Can we open the black box of AI?
137,Export laws: China is selling on surveillance technology to the rest of the world
138,I Want to Have Your Baby
139,Grad-CAM: Why did you say that? Visual Explanations from Deep Networks via Gradient-based Localization
140,Deep learning in neural networks: An overview
141,Who is afraid of a black Spider(-Man)?
142,TensorFlow: Large-Scale Machine Learning on Heterogeneous Distributed Systems
143,Deep Spiking Neural Networks: Study on the MNIST and N-MNIST Data Sets
144,Analysis of the MNIST Data Set with LIBSVM Software and K-Nearest Neighbors
145,Three Strategies to Success: Learning Adversary Models in Security Games
146,The growth of Diaspora - A decentralized online social network in the wild
147,Parametric Image Alignment Using Enhanced Correlation Coefficient Maximization
148,Visual Causal Feature Learning
149,Pylearn2: a machine learning research library
150,What is the best multi-stage architecture for object recognition?
151,Deep Sparse Rectifier Neural Networks
152,Multilayer feedforward networks are universal approximators
153,Theano: new features and speed improvements
154,Spatiotemporal Elements of Macaque V1 Receptive Fields
155,Under Review as a Conference Paper at Iclr 2017 Delving into Transferable Adversarial Ex- Amples and Black-box Attacks
156,Interpretable classifiers using rules and Bayesian analysis: Building a better stroke prediction model
157,Analyzing Computer Security - A Threat / Vulnerability / Countermeasure Approach
158,Data clustering: a review
159,Inherent Trade-Offs in the Fair Determination of Risk Scores
160,Are Loss Functions All the Same?
161,Visualizing Deep Convolutional Neural Networks Using Natural Pre-images
162,Learning SVMs from Sloppily Labeled Data
163,Good Word Attacks on Statistical Spam Filters
164,Exploring the Landscape of Spatial Robustness
165,CRC Handbook of Combinatorial Designs
166,A non-local algorithm for image denoising
167,Fast Approximate Energy Minimization via Graph Cuts
168,NO Need to Worry about Adversarial Examples in Object Detection in Autonomous Vehicles
169,Image quilting for texture synthesis and transfer
170,Deep Speech 2 : End-to-End Speech Recognition in English and Mandarin
171,Robustness of classifiers: from adversarial to random noise
172,Houdini: Fooling Deep Structured Prediction Models
173,Attacking the Madry Defense Model with L1-based Adversarial Examples
174,The Robust Manifold Defense: Adversarial Training using Generative Models
175,Letter: Primary amoebic meningoencephalitis after swimming in stream water.
176,A large annotated corpus for learning natural language inference
177,Robust Physical-World Attacks on Deep Learning Models
178,Caffe: Convolutional Architecture for Fast Feature Embedding
179,Return of the Devil in the Details: Delving Deep into Convolutional Nets
180,Virtual Adversarial Training: A Regularization Method for Supervised and Semi-Supervised Learning
181,Adversarial Examples Detection in Deep Networks with Convolutional Filter Statistics
182,Simple Black-Box Adversarial Perturbations for Deep Networks
183,Dermatologist-level classification of skin cancer with deep neural networks
184,Auto-Encoding Variational Bayes
185,Crafting adversarial input sequences for recurrent neural networks
186,Improving the Adversarial Robustness and Interpretability of Deep Neural Networks by Regularizing their Input Gradients
187,Feature-Guided Black-Box Safety Testing of Deep Neural Networks
188,Ensemble Methods as a Defense to Adversarial Perturbations Against Deep Neural Networks
189,Defense Against Universal Adversarial Perturbations
190,Keeping the Bad Guys Out: Protecting and Vaccinating Deep Learning with JPEG Compression
191,Detecting Adversarial Examples in Deep Networks with Adaptive Noise Reduction
192,Tactics of Adversarial Attack on Deep Reinforcement Learning Agents
193,Fast Feature Fool: A data independent approach to universal adversarial perturbations
194,BadNets: Identifying Vulnerabilities in the Machine Learning Model Supply Chain
195,NAG: Network for Adversary Generation
196,Towards Robust Deep Neural Networks with BANG
197,Adversarial Attacks Beyond the Image Space
198,A Unified Gradient Regularization Family for Adversarial Examples
199,Assessing Threat of Adversarial Examples on Deep Neural Networks
200,MatConvNet: Convolutional Neural Networks for MATLAB
201,A Closer Look at Memorization in Deep Networks
202,APE-GAN: Adversarial Perturbation Elimination with GAN
203,Contractive Auto-Encoders: Explicit Invariance During Feature Extraction
204,Art of Singular Vectors and Universal Adversarial Perturbations
205,Backpropagation Applied to Handwritten Zip Code Recognition
206,Differential Evolution: A Survey of the State-of-the-Art
207,Analysis of universal adversarial perturbations
208,Generative Adversarial Trainer: Defense to Adversarial Perturbations with GAN
209,Intriguing Properties of Adversarial Examples
210,DeepCloak: Masking Deep Neural Network Models for Robustness Against Adversarial Samples
211,A Learning and Masking Approach to Secure Learning
212,Improving the Robustness of Deep Neural Networks via Stability Training
213,Deep learning applications and challenges in big data analytics
214,Discovering Adversarial Examples with Momentum
215,Regularizing deep networks using efficient layerwise adversarial training
216,Can you fool AI with adversarial examples on a visual Turing test?
217,Robust Convolutional Neural Networks under Adversarial Noise
218,Extending Defensive Distillation
219,On the Limitation of Convolutional Neural Networks in Recognizing Negative Images
220,Geometric Robustness of Deep Networks: Analysis and Improvement
221,Adversarial Image Perturbation for Privacy Protection A Game Theory Perspective
222,Adversarial-Playground: A visualization suite showing how adversarial examples fool deep learning
223,Feature Squeezing Mitigates and Detects Carlini/Wagner Adversarial Examples
224,Comprehensive Approach to Modeling and Simulation of Photovoltaic Arrays
225,HyperNetworks with statistical filtering for defending adversarial examples
226,Are facial attributes adversarially robust?
227,Connectomic reconstruction of the inner plexiform layer in the mouse retina
228,Deep Neural Nets as a Method for Quantitative Structure-Activity Relationships
229,Digital selection and analogue amplification coexist in a cortex-inspired silicon circuit
230,Alleviating adversarial attacks via convolutional autoencoder
231,Manifold Regularized Deep Neural Networks using Adversarial Examples
232,JPEG-resistant Adversarial Images
233,Bounded activation functions for enhanced training stability of deep neural networks on visual pattern recognition problems
234,Generic Black-Box End-to-End Attack Against State of the Art API Call Based Malware Classifiers
235,Adversary Detection in Neural Networks via Persistent Homology
236,Vision-Based Traffic Sign Detection and Analysis for Intelligent Driver Assistance Systems: Perspectives and Survey
237,Practical Methods of Optimization
238,On the Robustness of Convolutional Neural Networks to Internal Architecture and Weight Perturbations
239,Improving generalization performance using double backpropagation
240,The human splicing code reveals new insights into the genetic determinants of disease
241,UPSET and ANGRI : Breaking High Performance Image Classifiers
242,Fooling Neural Networks in Face Attractiveness Evaluation: Adversarial Examples with High Attractiveness Score But Low Subjective Score
243,Soft biometric privacy: Retaining biometric utility of face images while perturbing gender
244,Dense Associative Memory for Pattern Recognition
245,Butterfly Effect: Bidirectional Control of Classification Performance by Small Additive Perturbation
246,An introduction to frames and Riesz bases
247,Mitigating fooling with competitive overcomplete output layer neural networks
248,The Higgs boson machine learning challenge
249,Online particle detection with Neural Networks based on topological calorimetry information
250,THERMOMETER ENCODING: ONE HOT WAY TO RESIST
251,Deep convolutional models improve predictions of macaque V1 responses to natural images
252,Managing Complex Networks: Strategies for the Public Sector
253,Mitigating Android Software Misuse Before It Happens
254,Self-Attention Generative Adversarial Networks
255,Scanning Electron Microscopy and X-Ray Microanalysis
256,Effect of Element on Porosity and Residual Stress Distribution of A7N01S-T5 Aluminum Alloy Welded Joints in High-Speed Trains
257,Adversarial Attacks on Face Detectors Using Neural Net Based Constrained Optimization
258,Robust Physical-World Attacks on Deep Learning Visual Classification
259,Fast R-CNN
260,DeepFace: Closing the Gap to Human-Level Performance in Face Verification
261,MobileNets: Efficient Convolutional Neural Networks for Mobile Vision Applications
262,The Pascal Visual Object Classes (VOC) Challenge
263,The PASCAL visual object classes challenge 2006 (VOC2006) results
264,Complete Replication of Hepatitis C Virus in Cell Culture
265,A Geologic Time Scale 2004: CONCEPTS AND METHODS
266,Clinical and immunological features of severe and moderate coronavirus disease 2019
267,"2016 IEEE Conference on Computer Vision and Pattern Recognition, CVPR 2016, Las Vegas, NV, USA, June 27-30, 2016"
268,Detection of the baryon acoustic peak in the large-scale correlation function of SDSS luminous red galaxies
269,YOLOv3: An Incremental Improvement
270,Metalation vs Nucleophilic Addition in the Reactions of N-Phenethylimides with Organolithium Reagents. Ready Access to Isoquinoline Derivatives via N-Acyliminium Ions and Parham-Type Cyclizations.
271,Nietzsche and Wagner
272,Distributed Statistical Machine Learning in Adversarial Settings: Byzantine Gradient Descent
273,Security Evaluation of Pattern Classifiers under Attack
274,AMC: AutoML for Model Compression and Acceleration on Mobile Devices
275,Random sampling with a reservoir
276,Net2Net: Accelerating Learning via Knowledge Transfer
277,Co-casting of Al and Al-foam
278,Directing students to profound open-book test preparation: The relationship between deep learning and open-book test time
279,Model compression
280,Man vs. computer: Benchmarking machine learning algorithms for traffic sign recognition
281,as a conference paper at ICLR 2018 O N THE CONVERGENCE OF A DAM AND B EYOND
282,An Analysis of Single-Layer Networks in Unsupervised Feature Learning
283,Improving neural networks by preventing co-adaptation of feature detectors
284,Stochastic Pooling for Regularization of Deep Convolutional Neural Networks
285,Practical Bayesian Optimization of Machine Learning Algorithms
286,Deep Boltzmann Machines
287,Improving Neural Networks with Dropout
288,Bagging predictors
289,Joint Training Deep Boltzmann Machines for Classification
290,Deep Convex Net: A Scalable Architecture for Speech Pattern Classification
291,Convolutional neural networks applied to house numbers digit classification
292,The Manifold Tangent Classifier
293,Reading Digits in Natural Images with Unsupervised Feature Learning
294,Learnable Pooling Regions for Image Classification
295,"Rank, Trace-Norm and Max-Norm"
296,On the piecewise analysis of networks of linear threshold neurons
297,"Deep, Big, Simple Neural Nets for Handwritten Digit Recognition"
298,A model of multiplicative neural responses in parietal cortex.
299,General constructive representations for continuous piecewise-linear functions
300,Face Recognition on Consumer Devices: Reflections on Replay Attacks
301,Exploiting Machine Learning to Subvert Your Spam Filter
302,Neural Machine Translation by Jointly Learning to Align and Translate
303,The clinical characteristics of coronary artery fistula anomalies in children and adults: A 24-year experience.
304,Workshop track-ICLR 2018 A SPECT-BASED Q UESTION G ENERATION
305,What Is Holding Back Convnets for Detection?
306,Manitest: Are classifiers really invariant?
307,Convolutional networks and applications in vision
308,Object Recognition with Gradient-Based Learning
309,Strategies for training large scale neural network language models
310,A Deep Learning Network Approach to ab initio Protein Secondary Structure Prediction
311,Deep autoencoder neural networks for gene ontology annotation predictions
312,CasADi: a software framework for nonlinear optimization and optimal control
313,Least-change secant update methods for undetermined systems
314,Development and validation of deep learning algorithms for scoliosis screening using back images
315,Referee consensus: a platform technology for nonlinear optimization
316,How transferable are features in deep neural networks?
317,A Fast Learning Algorithm for Deep Belief Nets
318,Exploring Strategies for Training Deep Neural Networks
319,Context-Dependent Pre-Trained Deep Neural Networks for Large-Vocabulary Speech Recognition
320,A unified architecture for natural language processing: deep neural networks with multitask learning
321,"Convolutional, Long Short-Term Memory, fully connected Deep Neural Networks"
322,Long short-term memory recurrent neural network architectures for large scale acoustic modeling
323,Deep Inside Convolutional Networks: Visualising Image Classification Models and Saliency Maps
324,Multi-column deep neural network for traffic sign classification
325,Network security - private communication in a public world
326,Evading network anomaly detection systems: formal reasoning and practical techniques
327,Fundamentals of computer security technology
328,Classification of MNIST Handwritten Digit Database using Neural Network
329,Scalable Handwritten Digit Recognition Application using Neural Network and Convolutional Neural Network On Heterogeneous Architecture
330,Understanding deep image representations by inverting them
331,Training Deep Convolutional Neural Networks to Play Go
332,Learning Deep Structured Models
333,The Virtues of Peer Pressure: A Simple Method for Discovering High-Value Mistakes
334,Deep Learners Benefit More from Out-of-Distribution Examples
335,Best practices for convolutional neural networks applied to visual document analysis
336,Image quality assessment: from error visibility to structural similarity
337,Parsing Natural Scenes and Natural Language with Recursive Neural Networks
338,Training Invariant Support Vector Machines using Selective Sampling
339,Fine-grained Recognition in the Noisy Wild: Sensitivity Analysis of Convolutional Neural Networks Approaches
340,Learning hierarchical invariant spatio-temporal features for action recognition with independent subspace analysis
341,Conditional Image Generation with PixelCNN Decoders
342,Semi-supervised Learning with Deep Generative Models
343,Deep Convolutional Inverse Graphics Network
344,"Learning to Generate Chairs, Tables and Cars with Convolutional Networks"
345,Variable Rate Image Compression with Recurrent Neural Networks
346,Video Pixel Networks
347,Bayesian Semisupervised Learning with Deep Generative Models
348,Perceptual Losses for Real-Time Style Transfer and Super-Resolution
349,Simple statistical gradient-following algorithms for connectionist reinforcement learning
350,Smart additive manufacturing empowered by a closed-loop machine learning algorithm
351,Inceptionism: Going Deeper into Neural Networks
352,R-FCN: Object Detection via Region-based Fully Convolutional Networks
353,DeepContour: A deep convolutional feature learned by positive-sharing loss for contour detection
354,"DeepLab: Semantic Image Segmentation with Deep Convolutional Nets, Atrous Convolution, and Fully Connected CRFs"
355,DeCAF: A Deep Convolutional Activation Feature for Generic Visual Recognition
356,Holistically-Nested Edge Detection
357,Feature Pyramid Networks for Object Detection
358,CNN Features Off-the-Shelf: An Astounding Baseline for Recognition
359,Conditional Random Fields as Recurrent Neural Networks
360,Unsupervised learning of object semantic parts from internal states of CNNs by population encoding
361,Discovering Internal Representations from Object-CNNs Using Population Encoding
362,The Cityscapes Dataset for Semantic Urban Scene Understanding
363,TwinNet: A Double Sub-Network Framework for Detecting Universal Adversarial Perturbations
364,Simple Black-Box Adversarial Attacks on Deep Neural Networks
365,Evading Classifiers by Morphing in the Dark
366,A Rotation and a Translation Suffice: Fooling CNNs with Simple Transformations
367,A geometric perspective on   the robustness of deep networks
368,The Robustness of Deep Networks: A Geometrical Perspective
369,On the Suitability of Lp-Norms for Creating and Preventing Adversarial Examples
370,Classification regions of deep neural networks
