,0
2860,Pylearn2: a machine learning research library
2861,Generative Moment Matching Networks
2862,Theano: A CPU and GPU Math Compiler in Python
2863,TensorFlow: A system for large-scale machine learning
2864,Show and tell: A neural image caption generator
2865,"Learning with Kernels: Support Vector Machines, Regularization, Optimization, and Beyond"
2866,Recursive Deep Models for Semantic Compositionality Over a Sentiment Treebank
2867,Robust Real-time Object Detection
2868,LSTM: A Search Space Odyssey
2869,Deep Learning: Methods and Applications
2870,Zero-Shot Learning Through Cross-Modal Transfer
2871,Multimodal learning with deep Boltzmann machines
2872,"The Elements of Statistical Learning: Data Mining, Inference, and Prediction, 2nd Edition"
2873,"Show, Attend and Tell: Neural Image Caption Generation with Visual Attention"
2874,A Learning Algorithm for Boltzmann Machines
2875,Unsupervised Representation Learning with Deep Convolutional Generative Adversarial Networks
2876,Laplacian Eigenmaps for Dimensionality Reduction and Data Representation
2877,On the Properties of Neural Machine Translation: Encoder-Decoder Approaches
2878,Probabilistic Graphical Models - Principles and Techniques
2879,Probabilistic Matrix Factorization
2880,Deep Neural Networks for Acoustic Modeling in Speech Recognition: The Shared Views of Four Research Groups
2881,Efficient discrete latent semantic hashing for scalable cross-modal retrieval
2882,From captions to visual concepts and back
2883,Empirical Evaluation of Gated Recurrent Neural Networks on Sequence Modeling
2884,Classification using discriminative restricted Boltzmann machines
2885,Learning deep structured semantic models for web search using clickthrough data
2886,Project Adam: Building an Efficient and Scalable Deep Learning Training System
2887,Pointer Networks
2888,Deep Visual-Semantic Alignments for Generating Image Descriptions
2889,Towards End-To-End Speech Recognition with Recurrent Neural Networks
2890,DianNao: a small-footprint high-throughput accelerator for ubiquitous machine-learning
2891,Semi-Supervised Recursive Autoencoders for Predicting Sentiment Distributions
2892,Deep Captioning with Multimodal Recurrent Neural Networks (m-RNN)
2893,Unifying Visual-Semantic Embeddings with Multimodal Neural Language Models
2894,The perceptron: a probabilistic model for information storage and organization in the brain.
2895,Statistical Language Models Based on Neural Networks
2896,Non-Uniform Random Variate Generation
2897,Connectionist Learning Procedures
2898,Receptive fields of single neurones in the cat's striate cortex
2899,A scaled conjugate gradient algorithm for fast supervised learning
2900,Ask Me Anything: Dynamic Memory Networks for Natural Language Processing
2901,Translating Embeddings for Modeling Multi-relational Data
2902,Learning to Forget: Continual Prediction with LSTM
2903,Neural networks and principal component analysis: Learning from examples without local minima
2904,Convolutional face finder: a neural architecture for fast and robust face detection
2905,DRAW: A Recurrent Neural Network For Image Generation
2906,How to Construct Deep Recurrent Neural Networks
2907,Automated optimized parameters for T-distributed stochastic neighbor embedding improve visualization and analysis of large datasets
2908,On Using Very Large Target Vocabulary for Neural Machine Translation
2909,Continuous space language models
2910,Universal approximation bounds for superpositions of a sigmoidal function
2911,Deep Learning with Limited Numerical Precision
2912,Neighbourhood Components Analysis
2913,Scheduled Sampling for Sequence Prediction with Recurrent Neural Networks
2914,Multiple Object Recognition with Visual Attention
2915,A METHOD FOR THE SOLUTION OF CERTAIN NON – LINEAR PROBLEMS IN LEAST SQUARES
2916,Estimation of probabilities from sparse data for the language model component of a speech recognizer
2917,Torch7: A Matlab-like Environment for Machine Learning
2918,From image-level to pixel-level labeling with Convolutional Networks
2919,Gradient Flow in Recurrent Nets: the Difficulty of Learning Long-Term Dependencies
2920,Survey on Independent Component Analysis
2921,Bayesian Convolutional Neural Networks with Bernoulli Approximate Variational Inference
2922,3D Object Recognition with Deep Belief Nets
2923,A Multi-View Deep Learning Approach for Cross Domain User Modeling in Recommendation Systems
2924,A general framework for adaptive processing of data structures
2925,Receptive fields and functional architecture of monkey striate cortex
2926,"A View of the Em Algorithm that Justifies Incremental, Sparse, and other Variants"
2927,Recursive Distributed Representations
2928,"Coupling Coordination Relationships between Urban-industrial Land Use Efficiency and Accessibility of Highway Networks: Evidence from Beijing-Tianjin-Hebei Urban Agglomeration, China"
2929,High Performance Convolutional Neural Networks for Document Processing
2930,No free lunch theorems for optimization
2931,Laplacian Eigenmaps and Spectral Techniques for Embedding and Clustering
2932,"A survey on opinion mining and sentiment analysis: Tasks, approaches and applications"
2933,Using very deep autoencoders for content-based image retrieval
2934,A Parallel Mixture of SVMs for Very Large Scale Problems
2935,End-To-End Memory Networks
2936,The general inefficiency of batch training for gradient descent learning
2937,Combining modality specific deep neural networks for emotion recognition in video
2938,Deep learning with COTS HPC systems
2939,Learning internal representations by error propagation
2940,Modeling pixel means and covariances using factorized third-order boltzmann machines
2941,Training a 3-node neural network is NP-complete
2942,Factored 3-Way Restricted Boltzmann Machines For Modeling Natural Images
2943,A neurobiological model of visual attention and invariant pattern recognition based on dynamic routing of information
2944,A Scalable Hierarchical Distributed Language Model
2945,On the Expressive Power of Deep Learning: A Tensor Analysis
2946,Grid Long Short-Term Memory
2947,The Netflix Prize
2948,Learning Deep Generative Models with Annealed Importance Sampling
2949,Alleviating the problem of local minima in Backpropagation through competitive learning
2950,Large scale image annotation: learning to rank with joint word-image embeddings
2951,"Scene parsing with Multiscale Feature Learning, Purity Trees, and Optimal Covers"
2952,Self-organizing neural network that discovers surfaces in random-dot stereograms
2953,From Group to Individual Labels Using Deep Features
2954,A Connection Between Score Matching and Denoising Autoencoders
2955,Towards AI-Complete Question Answering: A Set of Prerequisite Toy Tasks
2956,On the difficulty of training recurrent neural networks
2957,The Recurrent Temporal Restricted Boltzmann Machine
2958,Learning Entity and Relation Embeddings for Knowledge Graph Completion
2959,Deep Learning of Representations: Looking Forward
2960,Recurrent Continuous Translation Models
2961,Exploiting Similarities among Languages for Machine Translation
2962,Supervised Learning of Image Restoration with Convolutional Networks
2963,Zero-data Learning of New Tasks
2964,Learning to Represent Spatial Transformations with Factored Higher-Order Boltzmann Machines
2965,Joint Learning of Words and Meaning Representations for Open-Text Semantic Parsing
2966,Tangent Prop - A Formalism for Specifying Selected Invariances in an Adaptive Network
2967,Semantic Cognition: A Parallel Distributed Processing Approach
2968,Unsupervised Learning of Sparse Features for Scalable Audio Classification
2969,Reinforcement Learning Neural Turing Machines - Revised
2970,The Neural Autoregressive Distribution Estimator
2971,Learning to generate chairs with convolutional neural networks
2972,Optimization and applications of echo state networks with leaky- integrator neurons
2973,Exploiting the past and the future in protein secondary structure prediction
2974,Deep learning of the tissue-regulated splicing code
2975,Inducing Crosslingual Distributed Representations of Words
2976,Conditional Computation in Neural Networks for faster models
2977,The Lack of A Priori Distinctions Between Learning Algorithms
2978,Learning and Selecting Features Jointly with Point-wise Gated Boltzmann Machines
2979,Vocal Tract Length Perturbation (VTLP) improves speech recognition
2980,Probability theory: the logic of science
2981,Structural semantic interconnections: a knowledge-based approach to word sense disambiguation
2982,Neural Turing Machines
2983,Artificial neural networks in hardware: A survey of two decades of progress
2984,Multilingual Language Processing From Bytes
2985,Sequential Model-Based Optimization for General Algorithm Configuration
2986,Learning long-range vision for autonomous off-road driving
2987,Joint Training of a Convolutional Network and a Graphical Model for Human Pose Estimation
2988,Latent Variable Models and Factor Analysis: A Unified Approach
2989,From machine learning to machine reasoning
2990,End-to-end Continuous Speech Recognition using Attention-based Recurrent NN: First Results
2991,Conditional Restricted Boltzmann Machines for Structured Output Prediction
2992,Adaptive Nonlinear System Identification with Echo State Networks
2993,Learning Phrase Representations using RNN Encoder-Decoder for Statistical Machine Translation
2994,Synergistic Face Detection and Pose Estimation with Energy-Based Models
2995,On the Computational Power of Neural Nets
2996,Convolutional Networks Can Learn to Generate Affinity Graphs for Image Segmentation
2997,Deep Gaussian Processes for Regression using Approximate Expectation Propagation
2998,Hierarchical Recurrent Neural Networks for Long-Term Dependencies
2999,Discriminative Training of a Neural Network Statistical Parser
3000,BilBOWA: Fast Bilingual Distributed Representations without Word Alignments
3001,Anomaly Detection in Raw Audio Using Deep Autoregressive Networks
3002,Failure to detect changes to people during a real-world interaction
3003,Scaling up biologically-inspired computer vision: A case study in unconstrained face recognition on facebook
3004,Sentiment Analysis of Twitter Data : A Survey of Techniques
3005,Question Answering with Subgraph Embeddings
3006,The organization of behavior.
3007,Classification trees with neural network feature extraction
3008,Neural Networks in Machine Learning
3009,Mathematical methods of statistics
3010,Learning the easy things first: Self-paced visual category discovery
3011,Modeling Temporal Dependencies in High-Dimensional Sequences: Application to Polyphonic Music Generation and Transcription
3012,The visual microphone: passive recovery of sound from video
3013,Qualitatively characterizing neural network optimization problems
3014,Fast Inference in Sparse Coding Algorithms with Applications to Object Recognition
3015,Minimal Loss Hashing for Compact Binary Codes
3016,A useful theorem for nonlinear devices having Gaussian inputs
3017,Transformation Invariance in Pattern Recognition - Tangent Distance and Tangent Propagation
3018,Re-visiting the echo state property
3019,Learning to combine foveal glimpses with a third-order Boltzmann machine
3020,Deep Learning for Efficient Discriminative Parsing
3021,Manifold Parzen Windows
3022,An empirical study of smoothing techniques for language modeling
3023,The EM algorithm for mixtures of factor analyzers
3024,Low precision arithmetic for deep learning
3025,Learning a better representation of speech soundwaves using restricted boltzmann machines
3026,ReNet: A Recurrent Neural Network Based Alternative to Convolutional Networks
3027,Knowledge Graph and Text Jointly Embedding
3028,Computation of optical flow using a neural network
3029,Training Methods for Adaptive Boosting of Neural Networks
3030,Gradient-based Hyperparameter Optimization through Reversible Learning
3031,Learning Representations by Recirculation
3032,Information and the Accuracy Attainable in the Estimation of Statistical Parameters
3033,Discovering multiscale dynamical features with hierarchical Echo State Networks
3034,Indoor Semantic Segmentation using depth information
3035,Deep maxout neural networks for speech recognition
3036,Sum-product networks: A new deep architecture
3037,Fast and Robust Neural Network Joint Models for Statistical Machine Translation
3038,Modeling Documents with Deep Boltzmann Machines
3039,Unsupervised learning : foundations of neural computation
3040,Hessian Eigenmaps : new locally linear embedding techniques for high-dimensional data
3041,Deep Mixtures of Factor Analysers
3042,An Analysis of Unsupervised Pre-training in Light of Recent Advances
3043,Finite Precision Error Analysis of Neural Network Hardware Implementations
3044,Deep Learning of Invariant Spatio-Temporal Features from Video
3045,Estimation of Dependences Based on Empirical Data
3046,On Autoencoders and Score Matching for Energy Based Models
3047,Maximin affinity learning of image segmentation
3048,Learning with Graphical Models
3049,Deep Unsupervised Learning using Nonequilibrium Thermodynamics
3050,Teaching Classification Boundaries to Humans
3051,Modeling High-Dimensional Discrete Data with Multi-Layer Neural Networks
3052,A Study of the Recurrent Neural Network Encoder-Decoder for Large Vocabulary Speech Recognition
3053,What kind of graphical model is the brain?
3054,A model for reasoning about persistence and causation
3055,Continuous-Space Language Models for Statistical Machine Translation
3056,Toward automatic phenotyping of developing embryos from videos
3057,Using GPUs for machine learning algorithms
3058,Sampling from multimodal distributions using tempered transitions
3059,"Overtraining, regularization and searching for a minimum, with application to neural networks"
3060,Separation of a mixture of independent sources through a maximum likelihood approach
3061,Deep Supervised and Convolutional Generative Stochastic Network for Protein Secondary Structure Prediction
3062,On supervised learning from sequential data with applications for speech regognition
3063,"Massively Parallel Architectures for AI: NETL, Thistle, and Boltzmann Machines"
3064,Revisiting Reweighted Wake-Sleep for Models with Stochastic Control Flow
3065,Programmed to learn? The ontogeny of mirror neurons.
3066,The Potential Energy of an Autoencoder
3067,Generating more realistic images using gated MRF's
3068,Sample Complexity of Testing the Manifold Hypothesis
3069,Non-Local Manifold Tangent Learning
3070,Semi-Supervised Learning with Ladder Network
3071,Deep Belief Networks Are Compact Universal Approximators
3072,Cluster Kernels for Semi-Supervised Learning
3073,Learning Visual Feature Spaces for Robotic Manipulation with Deep Spatial Autoencoders
3074,Separation of a mixture of independent signals using time delayed correlations.
3075,Inductive Principles for Restricted Boltzmann Machine Learning
3076,Weakly Supervised Memory Networks
3077,"From Baby Steps to Leapfrog: How ""Less is More"" in Unsupervised Dependency Parsing"
3078,Empirical Evaluation and Combination of Advanced Language Modeling Techniques
3079,Training Products of Experts by Minimizing Contrastive Divergence
3080,Taking on the curse of dimensionality in joint distributions using neural networks
3081,Modeling Natural Images Using Gated MRFs
3082,"Slowness and Sparseness Lead to Place, Head-Direction, and Spatial-View Cells"
3083,Incorporating Second-Order Functional Knowledge for Better Option Pricing
3084,Exploiting Tractable Substructures in Intractable Networks
3085,Mapping Part-Whole Hierarchies into Connectionist Networks
3086,Spike-and-Slab Sparse Coding for Unsupervised Feature Discovery
3087,Freeze-Thaw Bayesian Optimization
3088,RNADE: The real-valued neural autoregressive density-estimator
3089,Stochastic Ratio Matching of RBMs for Sparse High-Dimensional Inputs
3090,Variational algorithms for linear algebra
3091,Learning Transferable and Discriminative Features by Differentiable Sparse Coding
3092,Unsupervised Models of Images by Spikeand-Slab RBMs
3093,Minima of Functions of Several Variables with Inequalities as Side Conditions
3094,Lesioning an Attractor Network: Investigations of Acquired Dyslexia
3095,Iterative Neural Autoregressive Distribution Estimator NADE-k
3096,A highly scalable Restricted Boltzmann Machine FPGA implementation
3097,Rectified Linear Units Improve Restricted Boltzmann Machines
3098,Learning in Markov Random Fields using Tempered Transitions
3099,The Epoch-Greedy algorithm for contextual multi-armed bandits
3100,On the Expressive Efficiency of Sum Product Networks
3101,The Variational Gaussian Approximation Revisited
3102,Online Learning for Offroad Robots: Using Spatial Label Propagation to Learn Long-Range Traversability
3103,NeuFlow: Dataflow vision processing system-on-a-chip
3104,Learning a Nonlinear Embedding by Preserving Class Neighbourhood Structure
3105,General Stochastic Networks for Classification
3106,Cooperative computation of stereo disparity.
3107,Refinements of Universal Approximation Results for Deep Belief Networks and Restricted Boltzmann Machines
3108,EXTENDED ENSEMBLE MONTE CARLO
3109,Continuous space language models for the IWSLT 2006 task
3110,GSNs : Generative Stochastic Networks
3111,Binary Sparse Coding of Convolutive Mixtures for Sound Localization and Separation via Spatialization
3112,Independent Component Analysis: Principles and Practice
3113,Parallel tempering is efficient for learning restricted Boltzmann machines
3114,The Impact of Arithmetic Representation on Implementing MLP-BP on FPGAs: A Study
3115,"Deep, Narrow Sigmoid Belief Networks Are Universal Approximators"
3116,Nonlinear independent component analysis: Existence and uniqueness results
3117,Restricted Boltzmann Machines are Hard to Approximately Evaluate or Simulate
3118,Graphical Models for Machine Learning and Digital Communication
3119,On the Efficient Classification of Data Structures by Neural Networks
3120,Nonequilibrium Equality for Free Energy Differences
3121,Invariant Object Recognition with Slow Feature Analysis
3122,Spert-II: A Vector Microprocessor System
3123,VC dimension of neural networks
3124,Combining Two And Three-Way Embeddings Models for Link Prediction in Knowledge Bases
3125,REMAP: Recursive Estimation and Maximization of A Posteriori Probabilities - Application to Transition-Based Connectionist Speech Recognition
3126,Learning language through pictures
3127,Visualizing Topographic Independent Component Analysis with Movies
3128,Reverse correlation in neurophysiology
3129,Self-Delimiting Neural Networks
3130,Long Short-Term Memory in Echo State Networks: Details of a Simulation Study
3131,A Comparison of the Computational Power of Sigmoid and Boolean Threshold Circuits
3132,When Does a Mixture of Products Contain a Product of Mixtures?
3133,On Tracking The Partition Function
3134,On causal and anticausal learning
3135,Estimating Ratios of Normalizing Constants Using Linked Importance Sampling
3136,The function of dream sleep
3137,Learning in Logic
3138,Learning Iterative Image Reconstruction in the Neural Abstraction Pyramid
3139,Applications of advances in nonlinear sensitivity analysis
3140,How Do Humans Teach: On Curriculum Learning and Teaching Dimension
3141,Universal Approximation Depth and Errors of Narrow Belief Networks with Discrete Units
3142,The appeal of parallel distributed processing
3143,Backpropagation without Multiplication
3144,Learning Bilingual Word Representations by Marginalizing Alignments
3145,Early Inference in Energy-Based Models Approximates Back-Propagation
3146,Emergence of Topography and Complex Cell Properties from Natural Images using Extensions of ICA
3147,Back propagation simulations using limited precision calculations
3148,Regularization and complexity control in feed-forward networks
3149,Learning to Play the Game of Chess
3150,Texture Modeling with Convolutional Spike-and-Slab RBMs and Deep Extensions
3151,Using Complex Variables to Estimate Derivatives of Real Functions
3152,Approximation properties of DBNs with binary hidden units and real-valued visible units
3153,Bounds for the computational power and learning complexity of analog neural nets
3154,Threshold circuits of bounded depth
3155,Fast Gradient-Based Inference with Continuous Latent Variable Models in Auxiliary Form
3156,A Theoretical Analysis of Optimization by Gaussian Continuation
3157,Adjusting Learning Rate of Memristor-Based Multilayer Neural Networks via Fuzzy Method
3158,Help me help you: Interfaces for personal robots
3159,Hallucinations in Charles Bonnet Syndrome Induced by Homeostasis: a Deep Boltzmann Machine Model
3160,Turing Machines Are Recurrent Neural Networks
3161,How to Center Binary Deep Boltzmann Machines
3162,Variational Generative Stochastic Networks with Collaborative Shaping
3163,Generalized Pseudo-Likelihood Estimates for Markov Random Fields on Lattice
3164,A learning algorithm for continually running fully re - SHENG - FU LIANG AND ALVIN W. Y. SU 1182 cur
3165,The Red and the Black: Studies in Greek Pottery
3166,A fixed point implementation of the backpropagation learning algorithm
3167,Taylor expansion of the accumulated rounding error
3168,Variance Reduction Techniques for Digital Simulation
3169,Asymptotic Efficiency of Deterministic Estimators for Discrete Energy-Based Models: Ratio Matching and Pseudolikelihood
3170,Ranking the Risk Factors for Cesarean: Logistic Regression Analysis of a Nationwide Study
3171,Automatic Hessians by reverse accumulation
3172,A method for solving the convex programming problem with convergence rate O(1/k^2)
3173,A Theoretical Analysis of Feature Pooling in Visual Recognition
3174,Adaptive switching circuits
3175,Algorithms for Hyper-Parameter Optimization
3176,Artificial neural networks and their application to sequence recognition
3177,"Autoencoders, Minimum Description Length and Helmholtz Free Energy"
3178,Bayesian Networks: A Model of Self-Activated Memory for Evidential Reasoning
3179,Bayesianly Justifiable and Relevant Frequency Calculations for the Applied Statistician
3180,Deep Tracking: Biologically Inspired Tracking with ! Deep Convolutional Networks !
3181,R\'eseau de neurones \`a synapses modifiables: d\'ecodage de messages sensoriels composites par apprentissage non supervis\'e et permanent
3182,DynFD: Functional Dependency Discovery in Dynamic Datasets
3183,Comparison of part-of-speech and automatically derived category-based language models for speech recognition
3184,Consistency of the Maximum Pseudo-Likelihood Estimator of Continuous State Space Gibbsian Processes
3185,Convex Analysis Princeton Landmarks in Math
3186,"Convex Analysisの二,三の進展について"
3187,Darpa Timit Acoustic-Phonetic Continuous Speech Corpus CD-ROM \TIMIT\ | NIST
3188,Deep content-based music recommendation
3189,Large Scale Image Segmentation with Structured Loss Based Deep Learning for Connectome Reconstruction
3190,Learning restricted Boltzmann machines via influence maximization
3191,Domain Adaptation for Large-Scale Sentiment Classification: A Deep Learning Approach
3192,Cognitive Therapy in a Nutshell 2nd Edition
3193,"Relationships between cognition, function, and quality of life among HIV+ Canadian men"
3194,Facing Up to Arrangements: Face-Count Formulas for Partitions of Space by Hyperplanes
3195,Lack of group-to-individual generalizability is a threat to human subjects research
3196,Gated Feedback Recurrent Neural Networks
3197,Generalized Denoising Auto-Encoders as Generative Models
3198,Generating Text with Recurrent Neural Networks
3199,Gradient Theory of Optimal Flight Paths
3200,A Gradient-based Bilevel Optimization Approach for Tuning Hyperparameters in Machine Learning
3201,Handwritten digit recognition: applications of neural network chips and automatic learning
3202,Hierarchical Probabilistic Neural Network Language Model
3203,Hogwild: A Lock-Free Approach to Parallelizing Stochastic Gradient Descent
3204,"How (not) to Train your Generative Model: Scheduled Sampling, Likelihood, Adversary?"
3205,How transferable are features in deep neural networks?
3206,ImageNet classification with deep convolutional neural networks
3207,Inter-donor variability of phase I/phase II metabolism of three reference drugs in cryopreserved primary human hepatocytes in suspension and monolayer.
3208,Reference Electrodes with Ionic Liquid Salt Bridge: When Will These Innovative Novel Reference Electrodes Gain Broad Acceptance?
3209,Improved clustering techniques for class-based statistical language modelling
3210,Improving efficiency of piezoelectric based energy harvesting from human motions using double pendulum system
3211,Independent Component Analysis: Principles and Practice
3212,Interpolated estimation of Markov source parameters from sparse data
3213,RotatE: Knowledge Graph Embedding by Relational Rotation in Complex Space
3214,An Inductive Logic Programming Approach to Learning Inclusion Axioms in Fuzzy Description Logics
3215,Learning representations by back-propagating errors
3216,Learning Stochastic Feedforward Neural Networks
3217,"Learning with kernels : Support vector machines, regularization, optimization, and beyond"
3218,Number detectors spontaneously emerge in a deep neural network designed for visual object recognition
3219,Fake Farsi: Formulaic Flexibility in Iranian American Women's Memoir
3220,Memoires associatives distribuees: Une comparaison (Distributed associative memories: A comparison)
3221,Metamorphoses of Functional Shapes in Sobolev Spaces
3222,Les R\'eseaux de neurones \'ecologiques : leurs apports \`a la compr\'ehension et \`a la simulation de ph\'enom\`enes psychologiques
3223,Global Inference for Aspect and Opinion Terms Co-Extraction Based on Multi-Task Neural Networks
3224,Hierarchical Multitask Learning With CTC
