,0
4346,Raccoon: Closing Digital Side-Channels through Obfuscated Execution
4347,The MovieLens Datasets: History and Context
4348,Secure Evaluation of Private Linear Branching Programs with Medical Applications
4349,ObliDB: Oblivious Query Processing for Secure Databases
4350,An 0(n log n) sorting network
4351,The Melbourne Shuffle: Improving Oblivious Storage in the Cloud
4352,Orthogonal Security with Cipherbase
4353,ML Confidential: Machine Learning on Encrypted Data
4354,"Secrets of Matrix Factorization: Approximations, Numerics, Manifold Optimization and Random Restarts"
4355,Sorting Short Keys in Circuits of Size o(n log n)
4356,C4.5: Programs for Machine Learning (書評)
4357,Directing students to profound open-book test preparation: The relationship between deep learning and open-book test time
4358,Torchreid: A Library for Deep Learning Person Re-Identification in Pytorch
4359,"Intel ® 64 and IA-32 Architectures Software Developer ’ s Manual Volume 3 A : System Programming Guide , Part 1"
4360,"25th USENIX Security Symposium, USENIX Security 16, Austin, TX, USA, August 10-12, 2016"
4361,IoTFuzzer: Discovering Memory Corruptions in IoT Through App-based Fuzzing
4362,A First Look: Using Linux Containers for Deceptive Honeypots
4363,Honware: A Virtual Honeypot Framework for Capturing CPE and IoT Zero Days
4364,Detect Me If You… Oh Wait. An Internet-Wide View of Self-Revealing Honeypots
4365,SIPHON: Towards Scalable High-Interaction Physical Honeypots
4366,Firmalice - Automatic Detection of Authentication Bypass Vulnerabilities in Binary Firmware
4367,IoTPOT: Analysing the Rise of IoT Compromises
4368,Detecting honeypots and other suspicious environments
4369,Ensembles in adversarial classification for spam
4370,Adversarial classification: An adversarial risk analysis approach
4371,Static detection of malicious JavaScript-bearing PDF documents
4372,GenProg: A Generic Method for Automatic Software Repair
4373,Genetic programming - on the programming of computers by means of natural selection
4374,Genetic programming for Reverse Engineering
4375,Genetic algorithms: principles of natural selection applied to computation.
4376,Automatic Re-engineering of Software Using Genetic Programming
4377,A Quest for Best: A Detailed Comparison Between Drakvuf-VMI-Based and Cuckoo Sandbox-Based Technique for Dynamic Malware Analysis
4378,draft-ietf-lsma-limitations-04 - Limitations of Internet Protocol Suite for Distributed Simulation the Large Multicast Environment
4379,Adversarial classification: An adversarial risk analysis approach
4380,Adversarial Machine Learning at Scale
4381,Mining adversarial patterns via regularized loss minimization
4382,Adversarial Pattern Classification Using Multiple Classifiers and Randomisation
4383,Classifier Evasion: Models and Open Problems
4384,Predictive defense against evolving adversaries
4385,Playing games for security: an efficient exact algorithm for solving Bayesian Stackelberg games
4386,Nash Equilibria of Static Prediction Games
4387,Moving Target Defense II: Application of Game Theory and Adversarial Modeling
4388,Software Assistants for Randomized Patrol Planning for the LAX Airport Police and the Federal Air Marshal Service
4389,Editors
4390,Intelligent Hollow Pt-CuS Janus Architecture for Synergistic Catalysis-Enhanced Sonodynamic and Photothermal Cancer Therapy.
4391,Learning in Neural Networks: Theoretical Foundations
4392,Adversarial classification: An adversarial risk analysis approach
4393,Machine Learning Strategies for Time Series Forecasting
4394,A Game Theoretical Model for Adversarial Learning
4395,An Empirical Comparison of Machine Learning Models for Time Series Forecasting
4396,Security Evaluation of Support Vector Machines in Adversarial Environments
4397,Undermining an Anomaly-Based Intrusion Detection System Using Common Exploits
4398,Matplotlib: A 2D Graphics Environment
4399,Optim: A mathematical optimization package for Julia
4400,Certified Robustness to Adversarial Examples with Differential Privacy
4401,Privacy Preserving Data Mining
4402,"On lattices, learning with errors, random linear codes, and cryptography"
4403,Probability Inequalities for sums of Bounded Random Variables
4404,Stability and Generalization of Graph Convolutional Neural Networks
4405,An Introduction to Computational Learning Theory
4406,Decision Theoretic Generalizations of the PAC Model for Neural Net and Other Learning Applications
4407,"Noise-tolerant learning, the parity problem, and the statistical query model"
4408,Neural Network Learning - Theoretical Foundations
4409,The Boundary Between Privacy and Utility in Data Publishing
4410,Weakly learning DNF and characterizing statistical query learning using Fourier analysis
4411,A Statistical Framework for Differential Privacy
4412,Toward efficient agnostic learning
4413,Occam's razor for big data? On detecting quality in large unstructured datasets
4414,A Framework for High-Accuracy Privacy-Preserving Mining
4415,Bounds on the sample complexity for private learning and private data release
4416,Secure Human Identification Protocols
4417,Pyramidal implementation of the lucas kanade feature tracker
4418,Privacy via pseudorandom sketches
4419,"Efficient, Differentially Private Point Estimators"
4420,Algorithmic Stability and Sanity-Check Bounds for Leave-One-Out Cross-Validation
4421,Bounded-concurrent secure multi-party computation with a dishonest majority
4422,Almost-everywhere Algorithmic Stability and Generalization Error
4423,Stability of Randomized Learning Algorithms
4424,On using extended statistical queries to avoid membership queries
4425,A Sober Look at Clustering Stability
4426,Generalization bounds for averaged classifiers
4427,Distribution-free performance bounds for potential function rules
4428,"Randomized Response, Statistical Disclosure Control and Misclassification: a Review"
4429,What Can We Learn Privately?
4430,On the design and quantification of privacy preserving data mining algorithms
4431,A Measure of Asymptotic Efficiency for Tests of a Hypothesis Based on the sum of Observations
4432,MobileNets: Efficient Convolutional Neural Networks for Mobile Vision Applications
4433,Substituting Lectures with Interactive Teaching in OBGYN Clerkship: Integrating Hands-on Learning with Theory
4434,Trimmomatic: a flexible trimmer for Illumina sequence data
4435,On Privacy-Preserving Search in the Encrypted Domain
4436,Hiding informative association rule sets
4437,RRreg: An R package for correlation and regression analyses of randomized response data
4438,"Advances in cryptology--ASIACRYPT 2001 : 7th International Conference on the Theory and Application of Cryptology and Information Security, Gold Coast, Australia, December 9-13, 2001 : proceedings"
4439,A Differentially Private Stochastic Gradient Descent Algorithm for Multiparty Classification
4440,Differentially private distributed logistic regression using private and public data
4441,Certified Robustness to Adversarial Examples with Differential Privacy
4442,Privacy-preserving data publishing: A survey of recent developments
4443,Crowd-ML: A Privacy-Preserving Learning Framework for a Crowd of Smart Devices
4444,Identifying suspicious URLs: an application of large-scale online learning
4445,More Efficient Constant-Round Multi-Party Computation from BMR and SHE
4446,"Bias, Variance , And Arcing Classifiers"
4447,Human Activity Recognition on Smartphones Using a Multiclass Hardware-Friendly Support Vector Machine
4448,"Automata, Languages and Programming, 33rd International Colloquium, ICALP 2006, Venice, Italy, July 10-14, 2006, Proceedings, Part II"
4449,A Survey of Privacy-Preservation of Graphs and Social Networks
4450,Virtual Adversarial Training: A Regularization Method for Supervised and Semi-Supervised Learning
4451,A method for obtaining digital signatures and public-key cryptosystems
4452,An improved algorithm for computing logarithms over GF(p) and its cryptographic significance (Corresp.)
4453,An Improved Algorithm for Computing Logarithms over GP(p) and Its Cryptographic Significance
4454,Efficient reducibility between programming systems (Preliminary Report)
4455,Analyzing the Effectiveness of Adversary Modeling in Security Games
4456,Security And Game Theory Algorithms Deployed Systems Lessons Learned
4457,"""A Game of Thrones"": When Human Behavior Models Compete in Repeated Stackelberg Security Games"
4458,Commitment Without Regrets: Online Learning in Stackelberg Security Games
4459,Learning Optimal Commitment to Overcome Insecurity
4460,Empirical Comparisons of Descriptive Multi-objective Adversary Models in Stackelberg Security Games
4461,Security Games with Protection Externalities
4462,Complexity of Computing Optimal Stackelberg Strategies in Security Resource Allocation Games
4463,Human Adversaries in Opportunistic Crime Security Games: Evaluating Competing Bounded Rationality Models
4464,Beware the Soothsayer: From Attack Prediction Accuracy to Predictive Reliability in Security Games
4465,Learning and Approximating the Optimal Strategy to Commit To
4466,Playing repeated Stackelberg games with unknown opponents
4467,Audit Games with Multiple Defender Resources
4468,Learning Cooperative Games
4469,Adaptive resource allocation for wildlife protection against illegal poachers
4470,Robust Protection of Fisheries with COmPASS
4471,ON CONVERGENCE OF STOCHASTIC PROCESSES
4472,"Entropy and ""-capacity of sets in func-tional spaces"
4473,Distance-Based Classification with Lipschitz Functions
4474,Leader-follower strategies for robotic patrolling in environments with arbitrary topologies
4475,Towards Addressing Challenges in Green Security Games in the Wild
4476,The art of computer programming: sorting and searching (volume 3)
4477,Volumes of Generalized Unit Balls
4478,A probabilistic interpretation of Eulerian numbers
4479,"Perfect vector sets, properly overlapping partitions, and largest empty box"
4480,Information Theory and Statistics.
4481,\OEuvres compl\`etes. \OEuvres romanesques (review)
4482,"The art of computer programming, volume 3: (2nd ed.) sorting and searching"
4483,Private traits and attributes are predictable from digital records of human behavior
4484,Implementing Anti-discrimination Policies in Statistical Profiling Models
4485,Is the Road to Disparate Impact Paved With Good Intentions? -- Stuck on State of Mind in Antidiscrimination Law
4486,"California Law Review : The Right to Privacy Revisited: Privacy, News, and Social Change, 1890–1990"
4487,Left ventricular myocardial deformation in Takotsubo syndrome: a cardiovascular magnetic resonance myocardial feature tracking study
4488,Essays in labor and experimental economics with a focus on crime and discrimination
4489,Adversarial classification: An adversarial risk analysis approach
4490,Learning nonstationary models of normal network traffic for detecting novel attacks
4491,Certified Robustness to Adversarial Examples with Differential Privacy
4492,The impact of CYP2C9 and VKORC1 genetic polymorphism and patient characteristics upon warfarin dose requirements: proposal for a new dosing regimen.
4493,A pharmacogenetic versus a clinical algorithm for warfarin dosing.
4494,"A Genome-Wide Association Study Confirms VKORC1, CYP2C9, and CYP4F2 as Principal Genetic Determinants of Warfarin Dose"
4495,On the rationale of maximum-entropy methods
4496,A Simple Generalisation of the Area Under the ROC Curve for Multiple Class Classification Problems
4497,The cost of privacy: destruction of data-mining utility in anonymized data publishing
4498,The disclosure of diagnosis codes can breach research participants' privacy
4499,Anonymization of electronic medical records for validating genome-wide association studies
4500,"Genotypes of the cytochrome p450 isoform, CYP2C9, and the vitamin K epoxide reductase complex subunit 1 conjointly determine stable warfarin dose: a prospective study"
4501,Pharmacogenetics of Warfarin in a Diverse Patient Population
4502,"Cost-effectiveness of warfarin: trial versus ""real-world"" stroke prevention in atrial fibrillation."
4503,Clinical Trial Simulation: A Review
4504,Optimizing Differential Identifiability Improves Connectome Predictive Modeling of Cognitive Deficits in Alzheimer\'s Disease
4505,The Promise of Differential Privacy: A Tutorial on Algorithmic Techniques
4506,The Power of Linear Reconstruction Attacks
4507,A Systems Approach to Designing Effective Clinical Trials Using Simulations
4508,"Myths and fallacies of ""Personally Identifiable Information"""
4509,Differentially Private M-Estimators
4510,Estimation of Treatment Effects from Combined Data: Identification versus Data Security
4511,Differential privacy for collaborative security
4512,A Practical Application of Differential Privacy to Personalized Online Advertising
4513,DWI-FLAIR mismatch for the identification of patients with acute ischaemic stroke within 4·5 h of symptom onset (PRE-FLAIR): a multicentre observational study
4514,Statistical design of personalized medicine interventions: The Clarification of Optimal Anticoagulation through Genetics (COAG) trial
4515,Differential Privacy
4516,Current Status of the International Normalized Ratio
4517,Reiterated Concerns and Further Challenges for Mindfulness and Meditation Research: A Reply to Davidson and Dahl
4518,Large and round ablation zones with microwave ablation: A preliminary study of an optimal aperiodic tri-slot coaxial antenna with the π-matching network section
4519,PharmGKB: the Pharmacogenomics Knowledge Base.
4520,What's hot and what's not: tracking most frequent items dynamically
4521,A framework for diagnosing changes in evolving data streams
4522,Frequency Estimation of Internet Packet Streams with Limited Space
4523,Exponentially weighted moving average control schemes: Properties and enhancements
4524,Mining time-changing data streams
4525,Adversarial Machine Learning at Scale
4526,Deployed ARMOR protection: the application of a game theoretic model for security at the Los Angeles International Airport
4527,Computing optimal randomized resource allocations for massive security games
4528,Security scheduling for real-world networks
4529,PROTECT: a deployed game theoretic system to protect the ports of the United States
4530,Secure or insure?: a game-theoretic analysis of information security games
4531,Computing optimal strategy against quantal response in security games
4532,Optimizing Active Cyber Defense
4533,A robust approach to addressing human adversaries in security games
4534,Risk-Averse Strategies for Security Games with Execution and Observational Uncertainty
4535,Refinement of Strong Stackelberg Equilibria in Security Games
4536,Security applications: lessons of real-world deployment
4537,Game-theoretic randomization for security patrolling with dynamic execution uncertainty
4538,Optimal patrol strategy for protecting moving targets with multiple mobile resources
4539,Improving Resource Allocation Strategy against Human Adversaries in Security Games
4540,Security Games with Arbitrary Schedules: A Branch and Price Approach
4541,The Iterated Weakest Link - A Model of Adaptive Security Investment
4542,Games of Timing for Security in Dynamic Environments
4543,Effective solutions for real-world Stackelberg games: when agents must deal with human uncertainties
4544,Game-theoretic resource allocation for malicious packet detection in computer networks
4545,Scaling-up Security Games with Boundedly Rational Adversaries: A Cutting-plane Approach
4546,Game-Theoretic Security Patrolling with Dynamic Execution Uncertainty and a Case Study on a Real Transit System
4547,Stop the compartmentalization: unified robust algorithms for handling uncertainties in security games
4548,Monotonic Maximin: A Robust Stackelberg Solution against Boundedly Rational Followers
4549,TRUSTS: Scheduling Randomized Patrols for Fare Inspection in Transit Systems Using Game Theory
4550,Computing the optimal strategy to commit to
4551,Game-Theoretic Algorithms for Optimal Network Security Hardening Using Attack Graphs
4552,Deception by Design: Evidence-Based Signaling Games for Network Defense
4553,Planning in the Presence of Cost Functions Controlled by an Adversary
4554,Audit Games with Multiple Defender Resources
4555,Quantal Response Equilibria for Normal Form Games
4556,Leadership with commitment to mixed strategies
4557,Security games in the field: an initial study on a transit system
4558,A Behavioral Investigation of the FlipIt Game
4559,On generalized Stackelberg strategies
4560,Branch-and-Price: Column Generation for Solving Huge Integer Programs
4561,Violence and Social Orders: The Conceptual Framework
4562,Sequential Stackelberg equilibria in two-person games
4563,Challenges in Patrolling to Maximize Pristine Forest Area (Position Paper)
4564,Security Games in Online Advertising: Can Ads Help Secure the Web?
4565,"Individual, situational, and cultural correlates of acquiescent responding: Towards a unified conceptual framework."
4566,Conceptualization of a Game Theoretic Approach to Air Marshal Scheduling
4567,Semantic Pooling for Complex Event Analysis in Untrimmed Videos
4568,Approximate Dynamic Program for Scheduling Federal Air Marshals in Real-Time
4569,Marktform und Gleichgewicht
4570,Playing games for security: an efficient exact algorithm for solving Bayesian Stackelberg games
4571,Prospect theory: An analysis of decision under risk Econometrica 47
4572,"Autograph: Toward Automated, Distributed Worm Signature Detection"
4573,"Dynamic Taint Analysis for Automatic Detection, Analysis, and SignatureGeneration of Exploits on Commodity Software"
4574,Automated Worm Fingerprinting
4575,Buttercup: on network-based detection of polymorphic buffer overflow vulnerabilities
4576,M.R. Hunter: Hunting for Metamorphic Relations by Puzzle Solving
4577,Honeycomb: creating intrusion detection signatures using honeypots
4578,Shield: vulnerability-driven network filters for preventing known vulnerability exploits
4579,Bro: a system for detecting network intruders in real-time
4580,Computer virus-antivirus coevolution
4581,An introduction to intrusion detection
4582,Identification of common molecular subsequences.
4583,Detecting subtle sequence signals: a Gibbs sampling strategy for multiple alignment.
4584,"Algorithms on Strings, Trees and Sequences: Computer Science and Computational Biology"
4585,MotifPrototyper: A Bayesian profile model for motif families
4586,LOGOS: a modular Bayesian model for de novo motif detection
4587,Snort--The Open Source Network Intrusion Detection System
4588,Color Set Size Problem with Application to String Matching
4589,Fitting a Mixture Model By Expectation Maximization To Discover Motifs In Biopolymer
4590,Inuring: Live Attacker-Guided Repair
4591,Detection of Novel Network Attacks Using Data Mining
4592,Motifprototyper: a profile bayesian model for motif family
4593,Polygraph: automatically generating signatures for polymorphic worms
4594,Polymorphic shellcode engine using spectrum analysis
4595,Sans institute - lion worm
4596,Metasploit: The Penetration Tester's Guide
4597,Domain.com discount 30% for .COM/.NET
4598,Not Just a Black Box: Learning Important Features Through Propagating Activation Differences
4599,Classification in the Presence of Label Noise: A Survey
4600,Characterizations of an Empirical Influence Function for Detecting Influential Cases in Regression
4601,"Influential Observations, High Leverage Points, and Outliers in Linear Regression"
4602,ModelTracker: Redesigning Performance Analysis Tools for Machine Learning
4603,Assessment of local influence for the analysis of agreement.
4604,Risk prediction models for hospital readmission: a systematic review.
4605,Model Selection in Kernel Based Regression using the Influence Function
4606,Assessing influence on predictions from generalized linear models
4607,Auditing Black-box Models by Obscuring Features
4608,On Robustness Properties of Convex Risk Minimization Methods for Pattern Recognition
4609,Second-Order Stochastic Optimization for Machine Learning in Linear Time
4610,Second Order Stochastic Optimization in Linear Time
4611,Generalized Leverage and its Applications
4612,Efficient Approximation of Cross-Validation for Kernel Methods using Bouligand Influence Function
4613,“Influence sketching”: Finding influential samples in large-scale regressions
4614,Debugging Machine Learning Models
4615,"Impact of HbA1c Measurement on Hospital Readmission Rates: Analysis of 70,000 Clinical Database Patient Records"
4616,Computational Issues in Time-Inconsistent Planning
4617,High-Dimensional Statistics: A Non-Asymptotic Viewpoint
4618,TensorFlow: Large-Scale Machine Learning on Heterogeneous Distributed Systems
4619,Confidence intervals for random forests: the jackknife and the infinitesimal jackknife
4620,Reliable blood supply chain network design with facility disruption: A real-world application
4621,Deep reinforcement learning for robotic manipulation with asynchronous off-policy updates
4622,Learning deep control policies for autonomous aerial vehicles with MPC-guided policy search
4623,A Comprehensive Survey of Multiagent Reinforcement Learning
4624,Reinforcement Learning is Direct Adaptive Optimal Control
4625,A survey of inverse reinforcement learning techniques
4626,Deep Active Learning for Autonomous Navigation
4627,Reinforcement learning in board games
4628,An approach to tune fuzzy controllers based on reinforcement learning for autonomous vehicle control
4629,Beginning Game Development with Python and Pygame: From Novice to Professional
4630,Application and network performance of Amazon elastic compute cloud instances
4631,An Introduction to Reinforcement Learning
4632,Testing network-based intrusion detection signatures using mutant exploits
4633,Defending against Internet worms: a signature-based approach
4634,Automatic generation of buffer overflow attack signatures: an approach based on program behavior models
4635,Advanced Polymorphic Worms: Evading IDS by Blending in with Normal Traffic
4636,Automatic generation and analysis of NIDS attacks
4637,An architecture for generating semantics-aware signatures
4638,An experience developing an IDS stimulator for the black-box testing of network intrusion detection systems
4639,Countering code-injection attacks with instruction-set randomization
4640,"Network Intrusion Detection: Evasion, Traffic Normalization, and End-to-End Protocol Semantics"
4641,Address Obfuscation: An Efficient Approach to Combat a Broad Range of Memory Error Exploits
4642,Code-Red: a case study on the spread and victims of an internet worm
4643,Inside the Slammer Worm
4644,Classless Inter-Domain Routing (CIDR): an Address Assignment and Aggregation Strategy
4645,A Quasi-Species Approach for Modeling the Dynamics of Polymorphic Worms
4646,Packet Payload Based Anomalous Network Intrusion Detection
4647,The Research of Advanced Evasion Attack Method Based On Metasploit And Fragroute
4648,Jempiscodes: Polymorphic shellcode generator
4649,Efficient Test Generation for Trojan Detection using Side Channel Analysis
4650,"2006 IEEE Symposium on Security and Privacy : (S&P 2006) : proceedings : 21-24 May 2006, Berkeley/Oakland, California"
4651,Tumour expressions of hypoxic markers predict the response to neo-adjuvant chemotherapy in children with inoperable rhabdomyosarcoma
4652,LSTM Neural Networks for Language Modeling
4653,Joint Language and Translation Modeling with Recurrent Neural Networks
4654,Multilingual Distributed Representations without Word Alignment
4655,Overcoming the Curse of Sentence Length for Neural Machine Translation using Automatic Segmentation
4656,Deep Neural Networks for Acoustic Modeling in Speech Recognition: The Shared Views of Four Research Groups
4657,Multi-column deep neural networks for image classification
4658,Edinburgh's Phrase-based Machine Translation Systems for WMT-14
4659,LIUM's SMT Machine Translation Systems for WMT 2012
4660,Backpropagation Through Time: What It Does and How to Do It
4661,Bleu: a Method for Automatic Evaluation of Machine Translation
4662,Complement Factor H Polymorphism in Age-Related Macular Degeneration
4663,On Small Depth Threshold Circuits
4664,One-step inactivation of chromosomal genes in Escherichia coli K-12 using PCR products.
4665,Understanding and improving recurrent networks for human activity recognition by continuous attention
4666,How to come to Le Mans University
4667,Cypher: An Evolving Query Language for Property Graphs
4668,Learning representations by back-propagating errors
4669,Context-Dependent Pre-Trained Deep Neural Networks for Large-Vocabulary Speech Recognition
4670,A Cloud Server Oriented FPGA Accelerator for LSTM Recurrent Neural Network
4671,Integrating short- and long-term statistics for short-crested waves in deep and intermediate waters
4672,The A2iA Multi-lingual Text Recognition System at the Second Maurdor Evaluation
4673,Untersuchungen zu dynamischen neuronalen Netzen
4674,MCF: a malicious code filter
4675,A Taxonomy of Obfuscating Transformations
4676,"Manufacturing cheap, resilient, and stealthy opaque constructs"
4677,Improving computer security using extended static checking
4678,Intrusion detection via static analysis
4679,Using programmer-written compiler extensions to catch security holes
4680,Typestate Checking of Machine Code
4681,M.R. Hunter: Hunting for Metamorphic Relations by Puzzle Solving
4682,MOPS: an infrastructure for examining security properties of software
4683,Attacking Malicious Code: A Report to the Infosec Research Council
4684,Safety checking of machine code
4685,Verification of control flow based security properties
4686,Bandera: extracting finite-state models from Java source code
4687,Detecting Manipulated Remote Call Streams
4688,Undecidability of static analysis
4689,On the (Im)possibility of Obfuscating Programs
4690,Translation validation for an optimizing compiler
