,0
1436,An Introduction to Variable and Feature Selection
1437,Neural Networks for Pattern Recognition
1438,Explaining Classifications For Individual Instances
1439,An introduction to kernel-based learning algorithms
1440,Dataset Shift in Machine Learning
1441,Learning with kernels
1442,A Probabilistic Theory of Pattern Recognition
1443,Covariate Shift Adaptation by Importance Weighted Cross Validation
1444,Direct Importance Estimation with Model Selection and Its Application to Covariate Shift Adaptation
1445,Decision theory in expert systems and artificial intelligence
1446,Assessing Approximate Inference for Binary Gaussian Process Classification
1447,Derivation and validation of toxicophores for mutagenicity prediction.
1448,Benchmark Data Set for in Silico Prediction of Ames Mutagenicity
1449,Explanation in Bayesian belief networks
1450,Gaussian Processes: A Method for Automatic QSAR Modeling of ADME Properties
1451,Towards a Model Independent Method for Explaining Classification for Individual Instances
1452,Center-surround patterns emerge as optimal predictors for human saccade targets.
1453,Estimating the domain of applicability for machine learning QSAR models: a study on aqueous solubility of drug discovery molecules
1454,Finding stationary subspaces in multivariate time series.
1455,Symmetrizing the Kullback-Leibler Distance
1456,Gaussian Processes for Classification: QSAR Modeling of ADMET and Target Activity
1457,Accurate Solubility Prediction with Error Bars for Electrolytes: A Machine Learning Approach
1458,Machine learning models for lipophilicity and their domain of applicability.
1459,A Probabilistic Approach to Classifying Metabolic Stability
1460,Automatic QSAR modeling of ADME properties: blood–brain barrier penetration and aqueous solubility
1461,Carcinogens as frameshift mutagens: metabolites and derivatives of 2-acetylaminofluorene and other aromatic amine carcinogens.
1462,Predicting Lipophilicity of Drug‐Discovery Molecules using Gaussian Process Models
1463,"Bacterial mutagenicity investigation of epoxides: drugs, drug metabolites, steroids and pesticides."
1464,Une m\'ethode d'interpr\'etation de scores
1465,Texture Recognition Based on VC++.net and SVM ToolBox of Matlab
1466,Probabilistic Outputs for Support vector Machines and Comparisons to Regularized Likelihood Methods
1467,Virtual Computational Chemistry Laboratory – Design and Description
1468,Robust statistics: the approach based on influence functions
1469,THE USE OF MULTIPLE MEASUREMENTS IN TAXONOMIC PROBLEMS
1470,The Elements of Statistical Learning
1471,"COVID-19 in a Long-Term Care Facility - King County, Washington, February 27-March 9, 2020."
1472,LibGuides: Government Documents - Executive Branch - Department of Health and Human Services: Administration for Community Living
1473,The Evolution of the Secretary’s Minority AIDS Initiative Fund: The US Department of Health and Human Services Responds to the National HIV/AIDS Strategy
1474,Western Washington State COVID-19 Experience: Keys to Flattening the Curve and Effective Health System Response
1475,[COVID-19 cluster study at a teaching hospital].
1476,"A Viewpoint on Angiotensin-Converting Enzyme 2, Anti-Hypertensives and Coronavirus Disease 2019 (COVID-19)."
1477,"Effects of a School-Based Health Intervention Program in Marginalized Communities of Port Elizabeth, South Africa (the KaziBantu Study): Protocol for a Randomized Controlled Trial"
1478,Brain tumor segmentation with Deep Neural Networks
1479,"Video-based lane estimation and tracking for driver assistance: survey, system, and evaluation"
1480,A Review of Computer Vision Techniques for the Analysis of Urban Traffic
1481,Multimodal Neuroimaging Feature Learning for Multiclass Diagnosis of Alzheimer's Disease
1482,Deep biomarkers of human aging: Application of deep neural networks to biomarker development
1483,Driver Inattention Monitoring System for Intelligent Vehicles: A Review
1484,"A Review of Smart Homes—Past, Present, and Future"
1485,Fast dropout training
1486,Learning with Marginalized Corrupted Features
1487,Simplifying Neural Networks by Soft Weight-Sharing
1488,Bayesian prediction of tissue-regulated splicing using RNA sequence and cellular context
1489,"Sex, mixability, and modularity"
1490,Combining spectral feature mapping and multi-channel model-based source separation for noise-robust automatic speech recognition
1491,"Large Scale Image Classification: Fast Feature Extraction, Multi-codebook Approach and Multi-core SVM Training"
1492,Compression of Conditional Deep Learning Network for Fast and Low Power Mobile Applications
1493,On the stability of inverse problems
1494,80 Million Tiny Images: A Large Data Set for Nonparametric Object and Scene Recognition
1495,Robust Object Recognition with Cortex-Like Mechanisms
1496,The “independent components” of natural scenes are edge filters
1497,Rate-coded Restricted Boltzmann Machines for Face Recognition
1498,A Mathematical Bibliography of Signed and Gain Graphs and Allied Areas
1499,Number detectors spontaneously emerge in a deep neural network designed for visual object recognition
1500,Innovation Engines: Automated Creativity and Improved Stochastic Optimization via Deep Learning
1501,On the Performance of Indirect Encoding Across the Continuum of Regularity
1502,Rectified Linear Units Improve Restricted Boltzmann Machines
1503,Compositional pattern producing networks: A novel abstraction of development
1504,A Taxonomy for Artificial Embryogeny
1505,"Bio-Inspired Artificial Intelligence: Theories, Methods, and Technologies"
1506,Picbreeder: evolving pictures collaboratively online
1507,Automated Evolution of Interesting Images
1508,Sferesv2: Evolvin' in the multi-core world
1509,Multi-objective Optimization using Evolutionary Algorithms
1510,"Principles of modularity, regularity, and hierarchy for scalable systems"
1511,Robots that can adapt like natural animals
1512,Is Second-Order Information Helpful for Large-Scale Visual Recognition?
1513,Principles of Modularity in Design and Maintenance of Locomotives
1514,Object Recognition using Visual Codebook Ms .
1515,Two-Stream Convolutional Networks for Action Recognition in Videos
1516,Scalable Object Detection Using Deep Neural Networks
1517,Large-Scale Video Classification with Convolutional Neural Networks
1518,Multi-scale Orderless Pooling of Deep Convolutional Activation Features
1519,DeViSE: A Deep Visual-Semantic Embedding Model
1520,Fisher Kernels on Visual Vocabularies for Image Categorization
1521,Simultaneous Detection and Segmentation
1522,Part-Based R-CNNs for Fine-Grained Category Detection
1523,Predicting Parameters in Deep Learning
1524,DeepPose: Human Pose Estimation via Deep Neural Networks
1525,Aggregating local descriptors into a compact image representation
1526,Are we ready for autonomous driving? The KITTI vision benchmark suite
1527,R-CNNs for Pose Estimation and Action Detection
1528,Supervised Sequence Labelling with Recurrent Neural Networks
1529,Locality-constrained Linear Coding for image classification
1530,Supervised translation-invariant sparse coding
1531,HMDB: A large video database for human motion recognition
1532,Real-time human pose recognition in parts from single depth images
1533,Evaluating knowledge transfer and zero-shot learning in a large-scale setting
1534,Structured Forests for Fast Edge Detection
1535,Provable Bounds for Learning Some Deep Representations
1536,Reconstructing the World* in Six Days *(As Captured by the Yahoo 100 Million Image Dataset)
1537,Blocks That Shout: Distinctive Parts for Scene Classification
1538,Segmentation as selective search for object recognition
1539,Leveraging Hierarchical Parametric Networks for Skeletal Joints Based Action Segmentation and Recognition
1540,Mid-level Visual Element Discovery as Discriminative Mode Seeking
1541,Max-Margin Markov Networks
1542,Predicting human gaze beyond pixels.
1543,Vision meets robotics: The KITTI dataset
1544,Recognizing indoor scenes
1545,Incremental Learning of NCM Forests for Large-Scale Image Classification
1546,Unnatural L0 Sparse Representation for Natural Image Deblurring
1547,Human action recognition by learning bases of action attributes and parts
1548,SUN: A Bayesian framework for saliency using natural statistics.
1549,Cosegmentation of Image Pairs by Histogram Matching - Incorporating a Global Constraint into MRFs
1550,Image Classification Using Super-Vector Coding of Local Image Descriptors
1551,Hollywood 3D: Recognizing Actions in 3D Natural Scenes
1552,Video Google: a text retrieval approach to object matching in videos
1553,Weakly Supervised Object Detection with Posterior Regularization
1554,HON4D: Histogram of Oriented 4D Normals for Activity Recognition from Depth Sequences
1555,Finding People in Images and Videos
1556,Action Recognition with Improved Trajectories
1557,Detecting People Using Mutually Consistent Poselet Activations
1558,Combining labeled and unlabeled data with co-training
1559,Secrets of optical flow estimation and their principles
1560,From learning models of natural image patches to whole image restoration
1561,Building Rome in a day
1562,Distance Metric Learning for Large Margin Nearest Neighbor Classification
1563,Pedestrian detection: A benchmark
1564,Representing and Recognizing the Visual Appearance of Materials using Three-dimensional Textons
1565,Multimodal templates for real-time detection of texture-less objects in heavily cluttered scenes
1566,Nonlocal Image Restoration With Bilateral Variance Estimation: A Low-Rank Approach
1567,Fast Approximate Energy Minimization with Label Costs
1568,Learning Output Kernels with Block Coordinate Descent
1569,Hand Pose Estimation and Hand Shape Classification Using Multi-layered Randomized Decision Forests
1570,Multiple View Geometry in Computer Vision
1571,Super Normal Vector for Activity Recognition Using Depth Sequences
1572,Convex multi-task feature learning
1573,Shared Segmentation of Natural Scenes Using Dependent Pitman-Yor Processes
1574,Image Deblurring and Super-Resolution by Adaptive Sparse Domain Selection and Adaptive Regularization
1575,Spatio-temporal Depth Cuboid Similarity Feature for Activity Recognition Using Depth Camera
1576,Visual tracking via adaptive structural local sparse appearance model
1577,Latent Regression Forest: Structured Estimation of 3D Articulated Hand Posture
1578,Representing moving images with layers
1579,Deformable Part Descriptors for Fine-Grained Recognition and Attribute Prediction
1580,From single image query to detailed 3D reconstruction
1581,Parsing the Hand in Depth Images
1582,Robust human action recognition via long short-term memory
1583,Semantic Label Sharing for Learning with Many Categories
1584,Action recognition by dense trajectories
1585,A Taxonomy and Evaluation of Dense Two-Frame Stereo Correspondence Algorithms
1586,A Survey on Multi-view Learning
1587,Learning 6D Object Pose Estimation Using 3D Object Coordinates
1588,Face Alignment by Explicit Shape Regression
1589,Data-driven visual similarity for cross-domain image matching
1590,Motion Detail Preserving Optical Flow Estimation
1591,Discriminative figure-centric models for joint action localization and recognition
1592,A Co-training Approach for Multi-view Spectral Clustering
1593,Class-specific Hough forests for object detection
1594,Convergent Tree-Reweighted Message Passing for Energy Minimization
1595,Real time head pose estimation with random regression forests
1596,Large Displacement Optical Flow: Descriptor Matching in Variational Motion Estimation
1597,Latent Dirichlet Allocation
1598,Stereo Processing by Semiglobal Matching and Mutual Information
1599,Scene Coordinate Regression Forests for Camera Relocalization in RGB-D Images
1600,Greedy function approximation: A gradient boosting machine.
1601,Learning to Detect Ground Control Points for Improving the Accuracy of Stereo Matching
1602,Building Rome on a Cloudless Day
1603,Corrected-Moment Illuminant Estimation
1604,Ensemble Learning for Confidence Measures in Stereo Vision
1605,Efficient Human Pose Estimation from Single Depth Images
1606,Alternating Decision Forests
1607,Spatiotemporal Deformable Part Models for Action Detection
1608,Blind Motion Deblurring Using Image Statistics
1609,"A Unified Video Segmentation Benchmark: Annotation, Metrics and Analysis"
1610,A Fully-Connected Layered Model of Foreground and Background Flow
1611,Scalable multi-class object detection
1612,Weakly Supervised Localization and Learning with Generic Knowledge
1613,A database for fine grained activity detection of cooking activities
1614,Hough Transform and 3D SURF for Robust Three Dimensional Classification
1615,Efficient Hand Pose Estimation from a Single Depth Image
1616,Regularization and variable selection via the elastic net
1617,Rolling Guidance Filter
1618,VocMatch: Efficient Multiview Correspondence for Structure from Motion
1619,Encoding High Dimensional Local Features by Sparse Coding Based Fisher Vectors
1620,Kernels for Vector-Valued Functions: a Review
1621,KinectFusion: Real-time dense surface mapping and tracking
1622,Modeling Temporal Structure of Decomposable Motion Segments for Activity Classification
1623,Clustered Multi-Task Learning: A Convex Formulation
1624,Solving the Multiple Instance Problem with Axis-Parallel Rectangles
1625,Affective image classification using features inspired by psychology and art theory
1626,Real-Time Articulated Hand Pose Estimation Using Semi-supervised Transductive Regression Forests
1627,Robust Facial Landmark Localization Based on Two-Stage Cascaded Pose Regression
1628,Multi-instance learning by treating instances as non-I.I.D. samples
1629,Regression Shrinkage and Selection via the Lasso
1630,Blind Deblurring Using Internal Patch Recurrence
1631,Three-Dimensional Model-Based Object Recognition and Segmentation in Cluttered Scenes
1632,Layered segmentation and optical flow estimation over time
1633,Articulated Human Detection with Flexible Mixtures of Parts
1634,"Model globally, match locally: Efficient and robust 3D object recognition"
1635,Video Action Detection with Relational Dynamic-Poselets
1636,Skeletal graphs for efficient structure from motion
1637,Photo tourism: exploring photo collections in 3D
1638,Global stereo reconstruction under second order smoothness priors
1639,Learning Multi-View Neighborhood Preserving Projections
1640,Alternating Regression Forests for Object Detection and Pose Estimation
1641,Graph Embedding and Extensions: A General Framework for Dimensionality Reduction
1642,A benchmark for the evaluation of RGB-D SLAM systems
1643,PatchMatch: a randomized correspondence algorithm for structural image editing
1644,Kernel-Based Weighted Multi-view Clustering
1645,Robust L/sub 1/ norm factorization in the presence of outliers and missing data by alternative convex programming
1646,"Layered image motion with explicit occlusions, temporal consistency, and depth ordering"
1647,Image restoration by sparse 3D transform-domain collaborative filtering
1648,Analyzing Co-training Style Algorithms
1649,Towards Linear-Time Incremental Structure from Motion
1650,Algebraic Functions For Recognition
1651,Exploiting the Power of Stereo Confidences
1652,Shape-based pedestrian parsing
1653,Learning structural SVMs with latent variables
1654,Non-uniform Deblurring for Shaken Images
1655,A Convex Formulation for Learning Task Relationships in Multi-Task Learning
1656,BLSTM-RNN Based 3D Gesture Classification
1657,Mixtures of trees for object recognition
1658,Fast motion deblurring
1659,Learning Rates of Regularized Regression With Multiple Gaussian Kernels for Multi-Task Learning
1660,Image deblurring and denoising using color priors
1661,Spectral Graph Reduction for Efficient Image and Streaming Video Segmentation
1662,Segmentation-Free Dynamic Scene Deblurring
1663,Learning to Estimate and Remove Non-uniform Image Blur
1664,Induction of Decision Trees
1665,Large-Scale Object Classification Using Label Relation Graphs
1666,Practical low-rank matrix approximation under robust L1-norm
1667,Single Image Deblurring Using Motion Density Functions
1668,Emotion related structures in large image databases
1669,A Quantitative Evaluation of Confidence Measures for Stereo Vision
1670,Locally Optimized RANSAC
1671,Background-subtraction using contour-based fusion of thermal and visible imagery
1672,Using Spin Images for Efficient Object Recognition in Cluttered 3D Scenes
1673,Interpretable aesthetic features for affective image classification
1674,Unifying Nuclear Norm and Bilinear Factorization Approaches for Low-Rank Matrix Decomposition
1675,A Thermal Infrared Video Benchmark for Visual Analysis
1676,Human Action Recognition by Representing 3D Skeletons as Points in a Lie Group
1677,Minimizing Energies with Hierarchical Costs
1678,"Computer vision -- ECCV 2014 : 13th European conference Zurich, Switzerland, September 6-12, 2014 : proceedings"
1679,Color lines: image specific color representation
1680,Robust real-time visual odometry for dense RGB-D mapping
1681,Pedestrian Classification and Detection in Far Infrared Images
1682,Demisting the Hough Transform for 3D Shape Recognition and Registration
1683,Multi-view clustering via canonical correlation analysis
1684,Smooth Representation Clustering
1685,Fast removal of non-uniform camera shake
1686,Higher-order clique reduction in binary graph cut
1687,Functional maps: a flexible representation of maps between shapes
1688,Estimating Optical Flow in Segmented Images Using Variable-Order Parametric Models With Local Deformations
1689,Efficient Mining of Frequent and Distinctive Feature Configurations
1690,People detection and tracking from aerial thermal views
1691,Dense Semi-rigid Scene Flow Estimation from RGBD Images
1692,Motion Competition: A Variational Approach to Piecewise Parametric Motion Segmentation
1693,Joint motion estimation and segmentation of complex scenes with label costs and occlusion modeling
1694,Iterative Thresholding for Sparse Approximations
1695,Analyzing spatially-varying blur
1696,Realtime and Robust Hand Tracking from Depth
1697,Interactive Markerless Articulated Hand Motion Tracking Using RGB and Depth Data
1698,Robust Global Translations with 1DSfM
1699,"Sparse Subspace Clustering: Algorithm, Theory, and Applications."
1700,Learning Must-Link Constraints for Video Segmentation Based on Spectral Clustering
1701,Weighted low rank approximations with provable guarantees
1702,What do eyes reveal about the mind?: Algorithmic inference of search targets from fixations
1703,Discrete-continuous optimization for large-scale structure from motion
1704,Outdoor stereo camera system for the generation of real-world benchmark data sets
1705,ForWaRD: Fourier-wavelet regularized deconvolution for ill-conditioned systems
1706,Fast maximum margin matrix factorization for collaborative prediction
1707,Efficient model-based 3D tracking of hand articulations using Kinect
1708,Simultaneous linear estimation of multiple view geometry and lens distortion
1709,SMILE: A Similarity-Based Approach for Multiple Instance Learning
1710,Efficient  \$l_\1\\$ -Norm-Based Low-Rank Matrix Approximations for Large-Scale Problems Using Alternating Rectified Gradient Method
1711,Closed-form solution of absolute orientation using unit quaternions
1712,Coupled quasi‐harmonic bases
1713,Self-weighted Multiview Clustering with Multiple Graphs
1714,Lines and Points in Three Views and the Trifocal Tensor
1715,Sparse Modeling of Intrinsic Correspondences
1716,Minimal Solutions for Panoramic Stitching with Radial Distortion
1717,Eye can read your mind: decoding gaze fixations to reveal categorical search targets.
1718,"An iterative integrated framework for thermal-visible image registration, sensor fusion, and people tracking for video surveillance applications"
1719,A Kernel Method for the Two-Sample-Problem
1720,Convex Clustering with Exemplar-Based Models
1721,MAP Estimation of Semi-Metric MRFs via Hierarchical Graph Cuts
1722,Projective reconstruction from line correspondences
1723,Fast and robust numerical solutions to minimal problems for cameras with radial distortion
1724,Structure from motion using line correspondences
1725,"On Two-Dimensional Sparse Matrix Partitioning: Models, Methods, and a Recipe"
1726,"Motion and Structure from Line Correspondences; Closed-Form Solution, Uniqueness, and Optimization"
1727,Mining data with random forests: A survey and results of new tests
1728,MDL-Based Decision Tree Pruning
1729,"Eye, brain, and vision"
1730,Scaling up matrix computations on shared-memory manycore systems with 1000 CPU cores
1731,Acceleration of stochastic approximation by averaging
1732,Block Variable Selection in Multivariate Regression and High-dimensional Causal Inference
1733,An Indigenous Methodology for Coming to Know Milo Pimatisiwin as Land-Based Initiatives for Indigenous Youth
1734,UCF101: A Dataset of 101 Human Actions Classes From Videos in The Wild
1735,Blended intrinsic maps
1736,Efficient hierarchical graph-based video segmentation
1737,Fast Algorithms for Mining Association Rules in Large Databases
1738,Optimization Algorithms on Matrix Manifolds
1739,Random Forests machine learning applied to gas chromatography - Mass spectrometry derived average mass spectrum data sets for classification and characterisation of essential oils.
1740,Support Vector Machines for Multiple-Instance Learning
1741,Unsupervised Discovery of Mid-Level Discriminative Patches
1742,ReVACNN: Real-Time Visual Analytics for Convolutional Neural Network
1743,Learning Unambiguous Reduced Sequence Descriptions
1744,Learning Sequential Structure with the Real-Time Recurrent Learning Algorithm
1745,A Local Learning Algorithm for Dynamic Feedforward and Recurrent Networks
1746,Continuous history compression
1747,Generalization of backpropagation with application to a recurrent gas market model
1748,Credit Assignment through Time: Alternatives to Backpropagation
1749,Learning Sequential Tasks by Incrementally Adding Higher Orders
1750,An Efficient Gradient-Based Algorithm for On-Line Training of Recurrent Network Trajectories
1751,Language Induction by Phase Transition in Dynamical Recognizers
1752,Adaptive neural oscillator using continuous-time back-propagation learning
1753,The Recurrent Cascade-Correlation Architecture
1754,Contrastive Learning and Neural Oscillations
1755,A focused back - propagation algorithm for temporal sequence recognition
1756,Bifurcations in the learning of recurrent neural networks
1757,Deterministic chaotic finite-state automata
1758,A learning rule for asynchronous perceptrons with feedback in a combinatorial environment
1759,A time delay neural network architecture for speech recognition
1760,Faster training of very deep networks via p-norm gates
1761,Generalization of back-propagation to recurrent neural networks.
1762,MapReduce: simplified data processing on large clusters
1763,Hogwild: A Lock-Free Approach to Parallelizing Stochastic Gradient Descent
1764,Parallelized Stochastic Gradient Descent
1765,Distributed GraphLab : A Framework for Machine Learning and Data Mining in the Cloud
1766,Distributed delayed stochastic optimization
1767,Distributed Training Strategies for the Structured Perceptron
1768,A reliable effective terascale linear learning system
1769,Efficient Large-Scale Distributed Training of Conditional Maximum Entropy Models
1770,Stochastic Gradient Learning in Neural Networks
1771,A scalable modular convex solver for regularized risk minimization
1772,Slow Learners are Fast
1773,Nested Subtree Hash Kernels for Large-Scale Graph Classification over Streams
1774,Deep Generative Stochastic Networks Trainable by Backprop
1775,Improving Importance Weighted Auto-Encoders with Annealed Importance Sampling
1776,Deep Boltzmann Machines and the Centering Trick
1777,"Empirical Risk Minimization of Graphical Model Parameters Given Approximate Inference, Decoding, and Model Structure"
1778,"Dependency Networks for Inference, Collaborative Filtering, and Data Visualization"
1779,Scaling Up Spike-and-Slab Models for Unsupervised Feature Learning
1780,Layer-wise learning of deep generative models
1781,Training energy-based models for time-series imputation
1782,On the convergence of markovian stochastic algorithms with rapidly decreasing ergodicity rates
1783,Conditional Expectation and Unbiased Sequential Estimation
1784,Learning Feature Hierarchies with Centered Deep Boltzmann Machines
1785,Linear Statistical Inference and Its Applications.
1786,Unbiased estimates for linear regression via volume sampling
1787,Two papers on EXTREMAL PROBLEMS IN COMPLEX ANALYSIS (American Mathematical Society Translations (2) 129)
1788,Python for Scientific Computing
1789,Algorithm 679: A set of level 3 basic linear algebra subprograms: model implementation and test programs
1790,Adaptive Algorithms and Stochastic Approximations
1791,A search for good multiple recursive random number generators
1792,Why Modern CPUs Are Starving and What Can Be Done about It
1793,Online Algorithms and Stochastic Approximations
1794,7 Acknowledgements
1795,Fast Python: NumPy and Cython
1796,"LAPACK Users' Guide, 3rd ed."
1797,A short course about fitting models with the `scipy.optimize` module
1798,Optlang: An algebraic modeling language for mathematical optimization
1799,Computing the coefficients for the power series solution of the Lane-Emden equation with the Python library SymPy
1800,????????????????? ??????????? ????????????????-2 ? ??????????? ??? TORCH-???????? ?? ????????? ??????? ? ?????? ???????? 5-6 ??????
1801,Deeply-Supervised Nets
1802,Deep Residual Learning for Image Recognition Supplementary Materials
1803,FitNets: Hints for Thin Deep Nets
1804,Convolutional neural networks at constrained time cost
1805,Deep Learning Made Easier by Linear Transformations in Perceptrons
